name,category,effect,sprite_url
Smart Candy L,Medicine,Increases a Pokémon's Special Attack stat.,https://img.pokemondb.net/sprites/items/smart-candy-l.png
Smart Candy XL,Medicine,Increases a Pokémon's Special Attack stat.,https://img.pokemondb.net/sprites/items/smart-candy-xl.png
Smiling Vee Pick,,"A pick designed after Eevee, sporting the Pokémon’s smiling face. It’s easy to grab by the ears, which is part of why it’s so popular.",https://img.pokemondb.net/s.png
Smoke Ball,Hold items,An item to be held by a Pokémon. It enables the holder to flee from any wild Pokémon without fail.,https://img.pokemondb.net/sprites/items/smoke-ball.png
Smoke Bomb,General items,,https://img.pokemondb.net/s.png
Smoke-Poke Tail,General items,"One of the many ingredients that can be used for cooking at your camp. When a Slowpoke’s tail falls off, it grows back quickly.",https://img.pokemondb.net/s.png
Smoked Fillet,,A very salty and bitter ingredient with that unmistakable smoky flavor. It pairs exceptionally well with veggies.,https://img.pokemondb.net/s.png
Smoliv Oil,General items,"Material obtained after defeating/catching Smoliv, used in TM crafting.",https://img.pokemondb.net/s.png
Smooth Rock,Hold items,A Pokémon held item that extends the duration of the move Sandstorm used by the holder.,https://img.pokemondb.net/sprites/items/smooth-rock.png
Sneasel Claw,General items,"Material obtained after defeating/catching Sneasel, used in TM crafting.",https://img.pokemondb.net/s.png
Snom Thread,General items,"Material obtained after defeating/catching Snom, used in TM crafting.",https://img.pokemondb.net/s.png
Snorlium Z,Hold items,"Allows Snorlax to upgrade Giga Impact to a Z-Move, Pulverizing Pancake.",https://img.pokemondb.net/sprites/items/snorlium-z.png
Snorunt Fur,General items,"Material obtained after defeating/catching Snorunt, used in TM crafting.",https://img.pokemondb.net/s.png
Snover Berries,General items,"Material obtained after defeating/catching Snover, used in TM crafting.",https://img.pokemondb.net/s.png
Snowball,Hold items,Raises Attack if hit by an Ice-type move.,https://img.pokemondb.net/sprites/items/snowball.png
Soda Pop,Medicine,Restores 50 HP.,https://img.pokemondb.net/sprites/items/soda-pop.png
Soft Sand,Hold items,Increases the power of Ground-type moves.,https://img.pokemondb.net/sprites/items/soft-sand.png
Solganium Z,Hold items,"Allows Solgaleo to upgrade Sunsteel Strike to a Z-Move, Searing Sunraze Smash.",https://img.pokemondb.net/sprites/items/solganium-z.png
Sootfoot Root,General items,,https://img.pokemondb.net/s.png
Soothe Bell,Hold items,An item to be held by a Pokémon. It is a bell with a comforting chime that calms the holder and makes it friendly.,https://img.pokemondb.net/sprites/items/soothe-bell.png
Soul Dew,Hold items,Increases the power of Psychic- and Dragon-type moves when held by Latios or Latias. Increases Sp.Atk/Sp.Def prior to Gen 7.,https://img.pokemondb.net/sprites/items/soul-dew.png
Soul Slate,,A slate overflowing with enigmatic energy. You can feel a strong connection between it and the Soul Room at Ramanas Park.,https://img.pokemondb.net/s.png
Sour Herba Mystica,,This surpassingly sour condiment is said to be super effective in helping the eater recover from exhaustion. Only a scant few people know it exists.,https://img.pokemondb.net/s.png
Spell Tag,Hold items,Increases the power of Ghost-type moves.,https://img.pokemondb.net/sprites/items/spell-tag.png
Spelon Berry,Berries,A Berry which is very rare in the Unova region. A maniac will buy it for a high price.,https://img.pokemondb.net/sprites/items/spelon-berry.png
Spice Mix,General items,One of the many ingredients that can be used for cooking at your camp. There are over fifty spices contained within this ingredient’s hot flavor.,https://img.pokemondb.net/s.png
Spicy Herba Mystica,,The legendary condiment said to have the mightiest of all spicy flavors. It’s said that a single bite will kick the metabolism into high gear immediately.,https://img.pokemondb.net/s.png
Spiritomb Fragment,General items,"Material obtained after defeating/catching Spiritomb, used in TM crafting.",https://img.pokemondb.net/s.png
Splash Plate,Hold items,Increases power of Water-type moves. Changes Arceus' type to Water.,https://img.pokemondb.net/sprites/items/splash-plate.png
Spoiled Apricorn,General items,,https://img.pokemondb.net/s.png
Spoink Pearl,General items,"Material obtained after defeating/catching Spoink, used in TM crafting.",https://img.pokemondb.net/s.png
Spooky Plate,Hold items,Increases power of Ghost-type moves. Changes Arceus' type to Ghost.,https://img.pokemondb.net/sprites/items/spooky-plate.png
Spooky Tablecloth,,A pop-art-style tablecloth with Pokémon faces floating up from the deep nighttime blue. This is a must-have for fans of Ghost types.,https://img.pokemondb.net/s.png
Sport Ball,Pokeballs,A special Poké Ball for the Bug-Catching Contest.,https://img.pokemondb.net/sprites/items/sport-ball.png
Springy Mushroom,General items,,https://img.pokemondb.net/s.png
Sprinklotad,General items,"A watering can shaped like a Lotad. It helps promote the healthy growth of any Berries planted in good, soft soil.",https://img.pokemondb.net/sprites/items/sprinklotad.png
Squall Slate,,A slate overflowing with enigmatic energy. You can feel a strong connection between it and the Squall Room at Ramanas Park.,https://img.pokemondb.net/s.png
Squawkabilly Feather,General items,"Material obtained after defeating/catching Squawkabilly, used in TM crafting.",https://img.pokemondb.net/s.png
Stable Mulch,General items,A fertilizer to be spread on soft soil in regions where Berries are grown. A maniac will buy it for a high price.,https://img.pokemondb.net/sprites/items/stable-mulch.png
Stantler Hair,General items,"Material obtained after defeating/catching Stantler, used in TM crafting.",https://img.pokemondb.net/s.png
Star Piece,General items,A shard of a pretty gem that sparkles in a red color. It can be sold at a high price to shops.,https://img.pokemondb.net/sprites/items/star-piece.png
Star Sweet,Hold items,Evolves Milcery into Star Flavor Alcremie.,https://img.pokemondb.net/s.png
Stardust,General items,"Lovely, red-colored sand with a loose, silky feel. It can be sold at a high price to shops.",https://img.pokemondb.net/sprites/items/stardust.png
Starf Berry,Berries,Sharply raises a random stat when HP is low.,https://img.pokemondb.net/sprites/items/starf-berry.png
Starly Feather,General items,"Material obtained after defeating/catching Starly, used in TM crafting.",https://img.pokemondb.net/s.png
Stealth Spray,General items,,https://img.pokemondb.net/s.png
Steel Bottle (B),,"A go-to bottle sometimes used while camping. The stainless steel keeps the temperature inside steady, making it great for keeping drinks hot or cold.",https://img.pokemondb.net/s.png
Steel Bottle (R),,"A go-to bottle sometimes used while camping. The stainless steel keeps the temperature inside steady, making it great for keeping drinks hot or cold.",https://img.pokemondb.net/s.png
Steel Bottle (Y),,"A go-to bottle sometimes used while camping. The stainless steel keeps the temperature inside steady, making it great for keeping drinks hot or cold.",https://img.pokemondb.net/s.png
Steel Gem,Hold items,Increases the power of a Steel-type move only once.,https://img.pokemondb.net/sprites/items/steel-gem.png
Steel Memory,Hold items,Changes Silvally and its move Multi-Attack to Steel type.,https://img.pokemondb.net/sprites/items/steel-memory.png
Steel Tera Shard,,Changes a Pokémon's Tera Type to Steel.,https://img.pokemondb.net/s.png
Steelium Z,Hold items,"Allows the use of Corkscrew Crash, the Steel type Z-Move.",https://img.pokemondb.net/sprites/items/steelium-z.png
Steelixite,Hold items,Enables Steelix to Mega Evolve during battle.,https://img.pokemondb.net/sprites/items/steelixite.png
Sticky Barb,Hold items,A held item that damages the holder on every turn. It may latch on to foes and allies that touch the holder.,https://img.pokemondb.net/sprites/items/sticky-barb.png
Sticky Glob,General items,,https://img.pokemondb.net/s.png
Stone Plate,Hold items,Increases power of Rock-type moves. Changes Arceus' type to Rock.,https://img.pokemondb.net/sprites/items/stone-plate.png
Stonjourner Stone,General items,"Material obtained after defeating/catching Stonjourner, used in TM crafting.",https://img.pokemondb.net/s.png
Strange Ball,Pokeballs,,https://img.pokemondb.net/s.png
Strange Souvenir,General items,An ornament depicting a Pokémon that is venerated as a protector in some region far from Kalos.,https://img.pokemondb.net/sprites/items/strange-souvenir.png
Stratospheric Slate,,A slate overflowing with enigmatic energy. You can feel a strong connection between it and the Stratospheric Room at Ramanas Park.,https://img.pokemondb.net/s.png
Strawberry,,"A very tart and sweet ingredient, popular for its ability to make a sandwich visually striking.",https://img.pokemondb.net/s.png
Strawberry Sweet,Hold items,Evolves Milcery into Strawberry Flavor Alcremie.,https://img.pokemondb.net/s.png
Stretchy Spring,General items,,https://img.pokemondb.net/s.png
Striped Bottle,,"A striped bottle that’s small, light, and even comes with a cup. The detachable strap makes it handy for walking around with.",https://img.pokemondb.net/s.png
Striped Cup,,"A cup for kids to use at picnics. It’s made of light but strong material. It’s stackable, which makes it handy for carrying around.",https://img.pokemondb.net/s.png
Striped Tablecloth,,"A tablecloth with a fashionable striped pattern. It’s great at repelling water and mold, and stains and smudges wipe right off.",https://img.pokemondb.net/s.png
Stunky Fur,General items,"Material obtained after defeating/catching Stunky, used in TM crafting.",https://img.pokemondb.net/s.png
Sun Stone,General items,Evolves certain species of Pokémon.,https://img.pokemondb.net/sprites/items/sun-stone.png
Sunkern Leaf,General items,"Material obtained after defeating/catching Sunkern, used in TM crafting.",https://img.pokemondb.net/s.png
Sunrise Flower Pick,,A flower pick designed to evoke a glorious sunrise. It’s part of a line of “sky-flower” picks. Using a few is guaranteed to boost that special picnic spirit.,https://img.pokemondb.net/s.png
Sunset Flower Pick,,A flower pick designed to evoke a blazing sunset. It’s part of a line of “sky-flower” picks. Using a few is guaranteed to boost that special picnic spirit.,https://img.pokemondb.net/s.png
Super Lure,General items,Attracts Pokémon in the wild.,https://img.pokemondb.net/s.png
Super Potion,Medicine,Restores 60 HP.,https://img.pokemondb.net/sprites/items/super-potion.png
Super Repel,General items,An item that prevents weak wild Pokémon from appearing for 200 steps after its use.,https://img.pokemondb.net/sprites/items/super-repel.png
Surskit Syrup,General items,"Material obtained after defeating/catching Surskit, used in TM crafting.",https://img.pokemondb.net/s.png
Swablu Fluff,General items,"Material obtained after defeating/catching Swablu, used in TM crafting.",https://img.pokemondb.net/s.png
Swampertite,Hold items,Enables Swampert to Mega Evolve during battle.,https://img.pokemondb.net/sprites/items/swampertite.png
Swap Snack,General items,,https://img.pokemondb.net/s.png
Sweet Apple,Hold items,Evolves Applin into Appletun.,https://img.pokemondb.net/s.png
Sweet Heart,Medicine,Very sweet chocolate. It restores the HP of one Pokémon by only 20 points.,https://img.pokemondb.net/sprites/items/sweet-heart.png
Sweet Herba Mystica,,A legendary condiment told of only in books. Word has it that one taste of its sweet flavor stimulates the digestive system and cures a lack of appetite.,https://img.pokemondb.net/s.png
Swift Feather,Medicine,Increases Speed EVs by 1.,https://img.pokemondb.net/sprites/items/swift-feather.png
Swift Mochi,Medicine,Increases Speed EVs.,https://img.pokemondb.net/s.png
Swordcap,General items,,https://img.pokemondb.net/s.png
Syrupy Apple,Hold items,Evolves Applin into Dipplin.,https://img.pokemondb.net/s.png
Tadbulb Mucus,General items,"Material obtained after defeating/catching Tadbulb, used in TM crafting.",https://img.pokemondb.net/s.png
Tamato Berry,Berries,Increases Friendship but lowers Speed EVs.,https://img.pokemondb.net/sprites/items/tamato-berry.png
Tandemaus Fur,General items,"Material obtained after defeating/catching Tandemaus, used in TM crafting.",https://img.pokemondb.net/s.png
Tanga Berry,Berries,Weakens a supereffective Bug-type attack against the holding Pokémon.,https://img.pokemondb.net/sprites/items/tanga-berry.png
Tapunium Z,Hold items,"Allows the Tapus to upgrade Nature's Madness to a Z-Move, Guardian of Alola.",https://img.pokemondb.net/sprites/items/tapunium-z.png
Tarountula Thread,General items,"Material obtained after defeating/catching Tarountula, used in TM crafting.",https://img.pokemondb.net/s.png
Tart Apple,Hold items,Evolves Applin into Flapple.,https://img.pokemondb.net/s.png
Tatsugiri Scales,General items,"Material obtained after defeating/catching Tatsugiri, used in TM crafting.",https://img.pokemondb.net/s.png
Tauros Hair,General items,"Material obtained after defeating/catching Tauros, used in TM crafting.",https://img.pokemondb.net/s.png
Tectonic Slate,,A slate overflowing with enigmatic energy. You can feel a strong connection between it and the Tectonic Room at Ramanas Park.,https://img.pokemondb.net/s.png
Teddiursa Claw,General items,"Material obtained after defeating/catching Teddiursa, used in TM crafting.",https://img.pokemondb.net/s.png
Tera Orb,,"An orb that holds within it the power to crystallize. When it is charged with energy, it can be used to cause Pokémon to Terastallize.",https://img.pokemondb.net/s.png
Terrain Extender,Hold items,An item to be held by a Pokémon. It extends the duration of the terrain caused by the holder's move or Ability.,https://img.pokemondb.net/sprites/items/terrain-extender.png
Thick Club,Hold items,Increases Attack when held by Cubone or Marowak.,https://img.pokemondb.net/sprites/items/thick-club.png
Throat Spray,Hold items,Raises Sp. Atk when a sound-based move is used.,https://img.pokemondb.net/s.png
Thunder Stone,General items,Evolves certain species of Pokémon.,https://img.pokemondb.net/sprites/items/thunder-stone.png
Timer Ball,Pokeballs,Catches Pokémon with a higher rate the more turns have occurred (up to 4x).,https://img.pokemondb.net/sprites/items/timer-ball.png
Timid Mint,Battle items,Changes the Pokémon's stats to match the Timid nature.,https://img.pokemondb.net/s.png
Tin of Beans,General items,"One of the many ingredients that can be used for cooking at your camp. When simmered, the beans suffuse a dish with their mild flavor.",https://img.pokemondb.net/s.png
Tinkatink Hair,General items,"Material obtained after defeating/catching Tinkatink, used in TM crafting.",https://img.pokemondb.net/s.png
Tiny Bamboo Shoot,,A small and rare bamboo shoot. It’s quite popular with a certain class of gourmands.,https://img.pokemondb.net/s.png
Tiny Mushroom,General items,A small and rare mushroom. It is sought after by collectors.,https://img.pokemondb.net/sprites/items/tiny-mushroom.png
TM00,Machines,Teaches the move Mega Punch.,https://img.pokemondb.net/s.png
TM001,Machines,Teaches the move Mega Punch/Dynamic Punch/Focus Punch/Hone Claws/Work Up/Headbutt/Mega Kick/Take Down.,https://img.pokemondb.net/sprites/items/tm-normal.png
TM002,Machines,Teaches the move Razor Wind/Headbutt/Dragon Claw/Taunt/Pay Day/Charm.,https://img.pokemondb.net/sprites/items/tm-dragon.png
TM003,Machines,Teaches the move Swords Dance/Curse/Water Pulse/Psyshock/Helping Hand/Fire Punch/Fake Tears.,https://img.pokemondb.net/sprites/items/tm-psychic.png
TM004,Machines,Teaches the move Whirlwind/Rollout/Calm Mind/Teleport/Ice Punch/Agility.,https://img.pokemondb.net/sprites/items/tm-psychic.png
TM005,Machines,Teaches the move Mega Kick/Roar/Rest/Thunder Punch/Mud-Slap.,https://img.pokemondb.net/sprites/items/tm-normal.png
TM006,Machines,Teaches the move Toxic/Light Screen/Fly/Scary Face.,https://img.pokemondb.net/sprites/items/tm-poison.png
TM007,Machines,Teaches the move Horn Drill/Zap Cannon/Hail/Protect/Pin Missile/Protect.,https://img.pokemondb.net/sprites/items/tm-ice.png
TM008,Machines,Teaches the move Body Slam/Rock Smash/Bulk Up/Substitute/Hyper Beam/Fire Fang.,https://img.pokemondb.net/sprites/items/tm-fighting.png
TM009,Machines,Teaches the move Take Down/Psych Up/Bullet Seed/Venoshock/Reflect/Giga Impact/Thunder Fang.,https://img.pokemondb.net/sprites/items/tm-poison.png
TM010,Machines,Teaches the move Double-Edge/Hidden Power/Dig/Magical Leaf/Work Up/Ice Fang.,https://img.pokemondb.net/sprites/items/tm-normal.png
TM011,Machines,Teaches the move BubbleBeam/Sunny Day/Will-O-Wisp/Solar Beam/Water Pulse.,https://img.pokemondb.net/sprites/items/tm-fire.png
TM012,Machines,Teaches the move Water Gun/Sweet Scent/Taunt/Facade/Solar Blade/Low Kick.,https://img.pokemondb.net/sprites/items/tm-dark.png
TM013,Machines,Teaches the move Ice Beam/Snore/Brick Break/Fire Spin/Acid Spray.,https://img.pokemondb.net/sprites/items/tm-ice.png
TM014,Machines,Teaches the move Blizzard/Fly/Thunder Wave/Acrobatics.,https://img.pokemondb.net/sprites/items/tm-ice.png
TM015,Machines,Teaches the move Hyper Beam/Seismic Toss/Dig/Struggle Bug.,https://img.pokemondb.net/sprites/items/tm-normal.png
TM016,Machines,Teaches the move Pay Day/Icy Wind/Light Screen/Thunder Wave/Screech/Psybeam.,https://img.pokemondb.net/sprites/items/tm-psychic.png
TM017,Machines,Teaches the move Submission/Protect/Dragon Tail/Light Screen/Confuse Ray.,https://img.pokemondb.net/sprites/items/tm-normal.png
TM018,Machines,Teaches the move Counter/Rain Dance/U-turn/Reflect/Thief.,https://img.pokemondb.net/sprites/items/tm-water.png
TM019,Machines,Teaches the move Seismic Toss/Giga Drain/Telekinesis/Roost/Iron Tail/Safeguard/Disarming Voice.,https://img.pokemondb.net/sprites/items/tm-flying.png
TM020,Machines,Teaches the move Rage/Endure/Safeguard/Dark Pulse/Self-Destruct/Trailblaze.,https://img.pokemondb.net/sprites/items/tm-normal.png
TM021,Machines,Teaches the move Mega Drain/Frustration/Foul Play/Rest/Dazzling Gleam/Pounce.,https://img.pokemondb.net/sprites/items/tm-normal.png
TM022,Machines,Teaches the move SolarBeam/Rock Slide/Chilling Water.,https://img.pokemondb.net/sprites/items/tm-grass.png
TM023,Machines,Teaches the move Dragon Rage/Iron Tail/Smack Down/Thunder Punch/Thief/Charge Beam.,https://img.pokemondb.net/sprites/items/tm-rock.png
TM024,Machines,Teaches the move Thunderbolt/DragonBreath/X-Scissor/Snore/Fire Spin.,https://img.pokemondb.net/sprites/items/tm-electric.png
TM025,Machines,Teaches the move Thunder/Waterfall/Protect/Facade.,https://img.pokemondb.net/sprites/items/tm-electric.png
TM026,Machines,Teaches the move Earthquake/Poison Jab/Scary Face/Poison Tail.,https://img.pokemondb.net/sprites/items/tm-ground.png
TM027,Machines,Teaches the move Fissure/Return/Toxic/Icy Wind/Low Sweep/Aerial Ace.,https://img.pokemondb.net/sprites/items/tm-normal.png
TM028,Machines,Teaches the move Dig/Leech Life/Tri Attack/Giga Drain/Bulldoze.,https://img.pokemondb.net/sprites/items/tm-bug.png
TM029,Machines,Teaches the move Psychic/Scald/Charm/Hex.,https://img.pokemondb.net/sprites/items/tm-psychic.png
TM030,Machines,Teaches the move Teleport/Shadow Ball/Bulk Up/Steel Wing/Snarl.,https://img.pokemondb.net/sprites/items/tm-ghost.png
TM031,Machines,Teaches the move Mimic/Mud-Slap/Brick Break/Fire Punch/Attract/Metal Claw.,https://img.pokemondb.net/sprites/items/tm-fighting.png
TM032,Machines,Teaches the move Double Team/Dazzling Gleam/Sandstorm/Swift.,https://img.pokemondb.net/sprites/items/tm-normal.png
TM033,Machines,Teaches the move Ice Punch/Reflect/Calm Mind/Rain Dance/Magical Leaf.,https://img.pokemondb.net/sprites/items/tm-psychic.png
TM034,Machines,Teaches the move Bide/Swagger/Shock Wave/Sludge Wave/Dragon Pulse/Sunny Day/Icy Wind.,https://img.pokemondb.net/sprites/items/tm-poison.png
TM035,Machines,Teaches the move Metronome/Sleep Talk/Flamethrower/Ice Punch/Hail/Mud Shot.,https://img.pokemondb.net/sprites/items/tm-fire.png
TM036,Machines,Teaches the move Self-Destruct/Sludge Bomb/Thunderbolt/Whirlpool/Rock Tomb.,https://img.pokemondb.net/sprites/items/tm-poison.png
TM037,Machines,Teaches the move Egg Bomb/Sandstorm/Flamethrower/Beat Up/Draining Kiss.,https://img.pokemondb.net/sprites/items/tm-rock.png
TM038,Machines,Teaches the move Fire Blast/Thunder/Will-O-Wisp/Flame Charge.,https://img.pokemondb.net/sprites/items/tm-fire.png
TM039,Machines,Teaches the move Swift/Rock Tomb/Outrage/Facade/Low Sweep.,https://img.pokemondb.net/sprites/items/tm-rock.png
TM040,Machines,Teaches the move Skull Bash/Defense Curl/Aerial Ace/Psychic/Swift/Air Cutter.,https://img.pokemondb.net/sprites/items/tm-flying.png
TM041,Machines,Teaches the move Soft-Boiled/Thunder Punch/Torment/Earthquake/Helping Hand/Stored Power.,https://img.pokemondb.net/sprites/items/tm-dark.png
TM042,Machines,Teaches the move Dream Eater/Facade/Self-Destruct/Revenge/Night Shade.,https://img.pokemondb.net/sprites/items/tm-normal.png
TM043,Machines,Teaches the move Sky Attack/Detect/Secret Power/Flame Charge/Shadow Ball/Brick Break/Volt Switch/Fling.,https://img.pokemondb.net/sprites/items/tm-fire.png
TM044,Machines,Teaches the move Rest/Play Rough/Imprison/Dragon Tail.,https://img.pokemondb.net/sprites/items/tm-psychic.png
TM045,Machines,Teaches the move Thunder Wave/Attract/Solar Beam/Dive/Venoshock.,https://img.pokemondb.net/sprites/items/tm-normal.png
TM046,Machines,Teaches the move Psywave/Thief/Fire Blast/Weather Ball/Avalanche.,https://img.pokemondb.net/sprites/items/tm-dark.png
TM047,Machines,Teaches the move Explosion/Steel Wing/Low Sweep/Surf/Fake Tears/Endure.,https://img.pokemondb.net/sprites/items/tm-fighting.png
TM048,Machines,Teaches the move Rock Slide/Fire Punch/Skill Swap/Round/Hyper Beam/Rock Tomb/Volt Switch.,https://img.pokemondb.net/sprites/items/tm-normal.png
TM049,Machines,Teaches the move Tri Attack/Fury Cutter/Snatch/Echoed Voice/Superpower/Sand Tomb/Scald/Sunny Day.,https://img.pokemondb.net/sprites/items/tm-normal.png
TM050,Machines,Teaches the move Substitute/Nightmare/Overheat/Roost/Bullet Seed/Rain Dance.,https://img.pokemondb.net/sprites/items/tm-fire.png
TM051,Machines,Teaches the move Roost/Ally Switch/Steel Wing/Blizzard/Icicle Spear/Sandstorm.,https://img.pokemondb.net/sprites/items/tm-steel.png
TM052,Machines,Teaches the move Focus Blast/Sludge Bomb/Bounce/Snowscape.,https://img.pokemondb.net/sprites/items/tm-fighting.png
TM053,Machines,Teaches the move Energy Ball/Mega Drain/Mud Shot/Smart Strike.,https://img.pokemondb.net/sprites/items/tm-grass.png
TM054,Machines,Teaches the move False Swipe/Flash Cannon/Rock Blast/Psyshock.,https://img.pokemondb.net/sprites/items/tm-normal.png
TM055,Machines,Teaches the move Brine/Scald/Ice Beam/Dig.,https://img.pokemondb.net/sprites/items/tm-water.png
TM056,Machines,Teaches the move Fling/Stealth Rock/U-turn/Bullet Seed.,https://img.pokemondb.net/sprites/items/tm-dark.png
TM057,Machines,Teaches the move Charge Beam/Pay Day/Payback/False Swipe.,https://img.pokemondb.net/sprites/items/tm-electric.png
TM058,Machines,Teaches the move Endure/Sky Drop/Drill Run/Assurance/Brick Break.,https://img.pokemondb.net/sprites/items/tm-flying.png
TM059,Machines,Teaches the move Dragon Pulse/Incinerate/Brutal Swing/Dream Eater/Fling/Zen Headbutt.,https://img.pokemondb.net/sprites/items/tm-dark.png
TM060,Machines,Teaches the move Drain Punch/Quash/Megahorn/Power Swap/U-turn.,https://img.pokemondb.net/sprites/items/tm-dark.png
TM061,Machines,Teaches the move Will-O-Wisp/Guard Swap/Shadow Claw.,https://img.pokemondb.net/sprites/items/tm-fire.png
TM062,Machines,Teaches the move Silver Wind/Acrobatics/Speed Swap/Bug Buzz/Foul Play.,https://img.pokemondb.net/sprites/items/tm-flying.png
TM063,Machines,Teaches the move Embargo/Drain Punch/Nasty Plot/Psychic Fangs.,https://img.pokemondb.net/sprites/items/tm-dark.png
TM064,Machines,Teaches the move Explosion/Avalanche/Bulk Up.,https://img.pokemondb.net/sprites/items/tm-normal.png
TM065,Machines,Teaches the move Shadow Claw/Air Slash.,https://img.pokemondb.net/sprites/items/tm-ghost.png
TM066,Machines,Teaches the move Payback/Thunder Fang/Body Slam.,https://img.pokemondb.net/sprites/items/tm-dark.png
TM067,Machines,Teaches the move Recycle/Retaliate/Smart Strike/Ice Fang/Fire Punch.,https://img.pokemondb.net/sprites/items/tm-steel.png
TM068,Machines,Teaches the move Giga Impact/Fire Fang/Thunder Punch.,https://img.pokemondb.net/sprites/items/tm-normal.png
TM069,Machines,Teaches the move Rock Polish/Psycho Cut/Ice Punch.,https://img.pokemondb.net/sprites/items/tm-rock.png
TM070,Machines,Teaches the move Flash/Aurora Veil/Trick Room/Sleep Talk.,https://img.pokemondb.net/sprites/items/tm-ice.png
TM071,Machines,Teaches the move Stone Edge/Wonder Room/Seed Bomb.,https://img.pokemondb.net/sprites/items/tm-rock.png
TM072,Machines,Teaches the move Avalanche/Volt Switch/Magic Room/Electro Ball.,https://img.pokemondb.net/sprites/items/tm-electric.png
TM073,Machines,Teaches the move Thunder Wave/Cross Poison/Drain Punch.,https://img.pokemondb.net/sprites/items/tm-electric.png
TM074,Machines,Teaches the move Gyro Ball/Venoshock/Reflect.,https://img.pokemondb.net/sprites/items/tm-steel.png
TM075,Machines,Teaches the move Swords Dance/Low Sweep/Light Screen.,https://img.pokemondb.net/sprites/items/tm-normal.png
TM076,Machines,Teaches the move Stealth Rock/Struggle Bug/Fly/Round/Rock Blast.,https://img.pokemondb.net/sprites/items/tm-flying.png
TM077,Machines,Teaches the move Psych Up/Hex/Waterfall.,https://img.pokemondb.net/sprites/items/tm-normal.png
TM078,Machines,Teaches the move Captivate/Bulldoze/Acrobatics/Snarl/Dragon Claw.,https://img.pokemondb.net/sprites/items/tm-ground.png
