move_name,type,category,power,accuracy,pp,makes_contact,introduced,effect,z_effect
Block,Normal,Status,,,5,false,3,"Opponent cannot flee or switch.Z-Move effectsWhen a Pokémon is holdingNormalium Zand uses its Z-Power,Blockturns intoZ-Blockand raises Defense one stage, in addition to its usual effect as above.","When a Pokémon is holdingNormalium Zand uses its Z-Power,Blockturns intoZ-Blockand raises Defense one stage, in addition to its usual effect as above."
Belch,Poison,Special,120,90,10,false,6,"Belchdeals damage, but only works if the user has previously consumed a Berry during the battle. Manually feeding a Berry from the bag does not count.","When a Pokémon is holdingPoisonium Zand uses its Z-Power,Belchturns intoAcid Downpourand has base power190."
Double Team,Normal,Status,,,15,false,1,"Double Teamraises the user's Evasiveness by one stage, thus making the user more difficult to hit.","When a Pokémon is holdingNormalium Zand uses its Z-Power,Double Teamturns intoZ-Double Teamand eliminates any stat drops applied to the user, in addition to its usual effect as above."
Fury Attack,Normal,Physical,15,85,20,true,1,"Fury Attackhits 2-5 times per turn used. The probability of each interval is shown in the table, with the total power after each hit.","When a Pokémon is holdingNormalium Zand uses its Z-Power,Fury Attackturns intoBreakneck Blitzand has base power100."
Swords Dance,Normal,Status,,,20,false,1,Swords Danceraises the user's Attack by two stages.,"When a Pokémon is holdingNormalium Zand uses its Z-Power,Swords Danceturns intoZ-Swords Danceand eliminates any stat drops applied to the user, in addition to its usual effect as above."
Rock Smash,Fighting,Physical,40,100,15,true,2,Rock Smashdeals damage and has a 50% chance of lowering the target's Defense by one stage.,"When a Pokémon is holdingFightinium Zand uses its Z-Power,Rock Smashturns intoAll-Out Pummelingand has base power100.Outside of battleRock Smashbreaks certain rocks that may be in your path. Smashing rocks may uncover wild Pokémon or items. Breakable rocks appear inGenerations 2-4andGeneration 6. Only rocks in Johto/Hoenn reveal Pokémon/items when smashed."
Heal Order,Bug,Status,,,10,false,4,Heal Orderrecovers up to 50% of the user's maximum HP.,"When a Pokémon is holdingBuginium Zand uses its Z-Power,Heal Orderturns intoZ-Heal Orderand eliminates any stat drops applied to the user, in addition to its usual effect as above."
Jump Kick,Fighting,Physical,100,95,10,true,1,"Jump Kickdeals damage, however, if it misses the userkeeps going and crashes,losing1⁄2of its maximum HP.Jump Kickcannot be used ifGravityis in effect.","When a Pokémon is holdingFightinium Zand uses its Z-Power,Jump Kickturns intoAll-Out Pummelingand has base power180."
Dragon Cheer,Dragon,Status,,,15,false,9,The user raises its allies’ morale with a draconic cry so that their future attacks have a heightened chance of landing critical hits. This rouses Dragon types more.,
Charge Beam,Electric,Special,50,90,10,false,4,Charge Beamdeals damage and has a 70% chance of raising the user's Special Attack by one stage.,"When a Pokémon is holdingElectrium Zand uses its Z-Power,Charge Beamturns intoGigavolt Havocand has base power100."
Leer,Normal,Status,,100,30,false,1,Leerlowers the target's Defense by one stage.,"When a Pokémon is holdingNormalium Zand uses its Z-Power,Leerturns intoZ-Leerand raises Attack one stage, in addition to its usual effect as above."
Comet Punch,Normal,Physical,18,85,15,true,1,"Comet Punchhits 2-5 times per turn used. The probability of each interval is shown in the table, with the total power after each hit.","When a Pokémon is holdingNormalium Zand uses its Z-Power,Comet Punchturns intoBreakneck Blitzand has base power100."
Entrainment,Normal,Status,,100,15,false,5,Entrainmentmakes the target's ability the same as the user's.,"When a Pokémon is holdingNormalium Zand uses its Z-Power,Entrainmentturns intoZ-Entrainmentand raises Special Defense one stage, in addition to its usual effect as above."
Sand-Attack,Ground,Status,,100,15,false,1,"Sand Attacklowers the target's Accuracy by one stage. Although it is aGround-type move it still affectsraisedPokémon. Raised Pokémon are anyFlyingtypes or those under the effects ofLevitate,Magnet RiseorTelekinesis. Full details inglossary.","When a Pokémon is holdingGroundium Zand uses its Z-Power,Sand Attackturns intoZ-Sand Attackand raises Evasiveness one stage, in addition to its usual effect as above."
Bubble Beam,Water,Special,65,100,20,false,1,Bubble Beamdeals damage and has a 10% chance of lowering the target's Speed by one stage.,"When a Pokémon is holdingWaterium Zand uses its Z-Power,Bubble Beamturns intoHydro Vortexand has base power120."
Spectral Thief,Ghost,Physical,90,100,10,true,7,"The user hides in the target's shadow, steals the target's stat boosts, and then attacks.Z-Move effectsWhen a Pokémon is holdingGhostium Zand uses its Z-Power,Spectral Thiefturns intoNever-Ending Nightmareand has base power175.When Marshadow is holdingMarshadium Zand uses its Z-Power,Spectral Thiefturns intoSoul-Stealing 7-Star Strikeand has base power195.","When a Pokémon is holdingGhostium Zand uses its Z-Power,Spectral Thiefturns intoNever-Ending Nightmareand has base power175.When Marshadow is holdingMarshadium Zand uses its Z-Power,Spectral Thiefturns intoSoul-Stealing 7-Star Strikeand has base power195."
GrassWhistle,Grass,Status,,55,15,false,3,"Grass Whistleputs the target to sleep, if it hits. Sleeping Pokémon cannot move (with some exceptions such asSnore). Sleep lasts for 1-3 turns.","When a Pokémon is holdingGrassium Zand uses its Z-Power,Grass Whistleturns intoZ-Grass Whistleand raises Speed one stage, in addition to its usual effect as above."
Dazzling Gleam,Fairy,Special,80,100,10,false,6,Dazzling Gleamdeals damage and hits all adjacent opponents in double/triple battles.,"When a Pokémon is holdingFairium Zand uses its Z-Power,Dazzling Gleamturns intoTwinkle Tackleand has base power160."
Dual Chop,Dragon,Physical,40,90,15,true,5,Dual Chopdeals damage and will strike twice (with 40 base power each time).,"When a Pokémon is holdingDragonium Zand uses its Z-Power,Dual Chopturns intoDevastating Drakeand has base power100."
Dark Pulse,Dark,Special,80,100,15,false,4,Dark Pulsedeals damage and has a 20% chance of causing the target to flinch (if the target has not yet moved).,"When a Pokémon is holdingDarkinium Zand uses its Z-Power,Dark Pulseturns intoBlack Hole Eclipseand has base power160."
PoisonPowder,Poison,Status,,75,35,false,1,Poison Powdercauses the target to become poisoned. Poisoned Pokémon lose1⁄8of their maximum HP each turn.,"When a Pokémon is holdingPoisonium Zand uses its Z-Power,Poison Powderturns intoZ-Poison Powderand raises Defense one stage, in addition to its usual effect as above."
Rock Slide,Rock,Physical,75,90,10,false,1,Rock Slidedeals damage and has a 30% chance of causing the target to flinch (if the target has not yet moved).,"When a Pokémon is holdingRockium Zand uses its Z-Power,Rock Slideturns intoContinental Crushand has base power140."
Screech,Normal,Status,,85,40,false,1,Screechlowers the target's Defense by two stages.,"When a Pokémon is holdingNormalium Zand uses its Z-Power,Screechturns intoZ-Screechand raises Attack one stage, in addition to its usual effect as above."
Precipice Blades,Ground,Physical,120,85,10,false,6,Precipice Bladesdeals damage and hits all adjacent opponents in double/triple battles.,"When a Pokémon is holdingGroundium Zand uses its Z-Power,Precipice Bladesturns intoTectonic Rageand has base power190."
Shift Gear,Steel,Status,,,10,false,5,Shift Gearraises the user's Attack by one stage and Speed by two stages.,"When a Pokémon is holdingSteelium Zand uses its Z-Power,Shift Gearturns intoZ-Shift Gearand eliminates any stat drops applied to the user, in addition to its usual effect as above."
Slack Off,Normal,Status,,,5,false,3,Slack Offrecovers up to 50% of the user's maximum HP.,"When a Pokémon is holdingNormalium Zand uses its Z-Power,Slack Offturns intoZ-Slack Offand eliminates any stat drops applied to the user, in addition to its usual effect as above."
Sweet Kiss,Fairy,Status,,75,10,false,2,"Sweet Kisscauses the target to become confused. Confused Pokémon have a 33% chance of hurting themselves each turn, for 1-4 attacking turns (50% chance inGenerations 1-6). The damage received is as if the Pokémon attacks itself with a typeless 40 base power Physical attack.","When a Pokémon is holdingFairium Zand uses its Z-Power,Sweet Kissturns intoZ-Sweet Kissand raises Special Attack one stage, in addition to its usual effect as above."
Swift,Normal,Special,60,,20,false,1,"Swiftdeals damage and ignores changes to the Accuracy and Evasion stats. However, it will not hit Pokémon during the invulnerable stage ofBounce,Dig,Dive,Fly,Phantom Force,Shadow ForceorSky Drop.","When a Pokémon is holdingNormalium Zand uses its Z-Power,Swiftturns intoBreakneck Blitzand has base power120."
Revelation Dance,Normal,Special,90,100,15,false,7,Revelation Dancedeals damage with a different type depending on the style of Oricorio:,"When a Pokémon is holdingNormalium Zand uses its Z-Power,Revelation Danceturns intoBreakneck Blitzand has base power175."
Pluck,Flying,Physical,60,100,20,true,4,"If the opponent is holding a berry, its effect is stolen by user.Z-Move effectsWhen a Pokémon is holdingFlyinium Zand uses its Z-Power,Pluckturns intoSupersonic Skystrikeand has base power120.","When a Pokémon is holdingFlyinium Zand uses its Z-Power,Pluckturns intoSupersonic Skystrikeand has base power120."
Payback,Dark,Physical,50,100,10,true,4,"Power doubles if the user was attacked first.Z-Move effectsWhen a Pokémon is holdingDarkinium Zand uses its Z-Power,Paybackturns intoBlack Hole Eclipseand has base power100.","When a Pokémon is holdingDarkinium Zand uses its Z-Power,Paybackturns intoBlack Hole Eclipseand has base power100."
Shore Up,Ground,Status,,,5,false,7,"The user regains up to half of its max HP. It restores more HP in a sandstorm.ChangesInGenerations 7-8,Shore Uphas 10 PP.Z-Move effectsWhen a Pokémon is holdingGroundium Zand uses its Z-Power,Shore Upturns intoZ-Shore Upand eliminates any stat drops applied to the user, in addition to its usual effect as above.","When a Pokémon is holdingGroundium Zand uses its Z-Power,Shore Upturns intoZ-Shore Upand eliminates any stat drops applied to the user, in addition to its usual effect as above."
Phantom Force,Ghost,Physical,90,100,10,true,6,"Phantom Forcecauses the user to disappear on the first turn, becoming invulnerable to most attacks. On the second turn, it deals damage and can hit Pokémon usingProtectorDetect.","When a Pokémon is holdingGhostium Zand uses its Z-Power,Phantom Forceturns intoNever-Ending Nightmareand has base power175."
Captivate,Normal,Status,,100,20,false,4,"Captivatelowers the Special Attack of the target by two stages, if they are of the opposite gender to the user. Stats can be lowered to a minimum of -6 stages each.","When a Pokémon is holdingNormalium Zand uses its Z-Power,Captivateturns intoZ-Captivateand raises Special Defense two stages, in addition to its usual effect as above."
Will-O-Wisp,Fire,Status,,85,15,false,3,"Will-O-Wispcauses the target to become burned, if it hits. Burned Pokémon lose1⁄8of their maximum HP each turn and their Attack is decreased by 50%.","When a Pokémon is holdingFirium Zand uses its Z-Power,Will-O-Wispturns intoZ-Will-O-Wispand raises Attack one stage, in addition to its usual effect as above."
Bone Club,Ground,Physical,65,85,20,false,1,Bone Clubdeals damage and has a 10% chance of causing the target to flinch (if the target has not yet moved).,"When a Pokémon is holdingGroundium Zand uses its Z-Power,Bone Clubturns intoTectonic Rageand has base power120."
Stomping Tantrum,Ground,Physical,75,100,10,true,7,"Driven by frustration, the user attacks the target. If the user's previous move has failed, the power of this move doubles.Z-Move effectsWhen a Pokémon is holdingGroundium Zand uses its Z-Power,Stomping Tantrumturns intoTectonic Rageand has base power140.","When a Pokémon is holdingGroundium Zand uses its Z-Power,Stomping Tantrumturns intoTectonic Rageand has base power140."
Luster Purge,Psychic,Special,95,100,5,false,3,Luster Purgedeals damage and has a 50% chance of lowering the target's Special Defense by one stage.,"When a Pokémon is holdingPsychium Zand uses its Z-Power,Luster Purgeturns intoShattered Psycheand has base power140."
Trump Card,Normal,Special,,,5,true,4,"Trump Cardinflicts more damage when fewer PP are left, as per the table. The power is calculated based on the PP remainingafter the move has been used;this is to account for the abilityPressurewhich deducts 2 PP for each move.","When a Pokémon is holdingNormalium Zand uses its Z-Power,Trump Cardturns intoBreakneck Blitzand has base power160."
Flail,Normal,Physical,,100,15,true,2,Flaildeals more damage the lower the user's HP. The following formula is used:,"When a Pokémon is holdingNormalium Zand uses its Z-Power,Flailturns intoBreakneck Blitzand has base power160."
Laser Focus,Normal,Status,,,30,false,7,"User's next attack is guaranteed to result in a critical hit.Z-Move effectsWhen a Pokémon is holdingNormalium Zand uses its Z-Power,Laser Focusturns intoZ-Laser Focusand raises Attack one stage, in addition to its usual effect as above.","When a Pokémon is holdingNormalium Zand uses its Z-Power,Laser Focusturns intoZ-Laser Focusand raises Attack one stage, in addition to its usual effect as above."
Ceaseless Edge,Dark,Physical,65,90,15,true,8,"Ceaseless Edgedeals damage and lays a trap of thorns on the opposing field, likeSpikes, which damage opponents switching into battle.",
Metal Claw,Steel,Physical,50,95,35,true,2,Metal Clawdeals damage and has a 10% chance of raising the user's Attack by one stage.,"When a Pokémon is holdingSteelium Zand uses its Z-Power,Metal Clawturns intoCorkscrew Crashand has base power100."
Sludge Wave,Poison,Special,95,100,10,false,5,Sludge Wavedeals damage and has a 10% chance of poisoning the target.,"When a Pokémon is holdingPoisonium Zand uses its Z-Power,Sludge Waveturns intoAcid Downpourand has base power175."
Chloroblast,Grass,Special,150,95,5,false,8,"Chloroblastdeals damage, but the user loses1⁄2of its maximum HP.",
Fake Out,Normal,Physical,40,100,10,true,3,"Fake Outattacks with a priority of +3 and causes the target to flinch if it hits. It is only successful on the first turn the Pokémon is in battle, but reset each time the Pokémon switches out and back in.","When a Pokémon is holdingNormalium Zand uses its Z-Power,Fake Outturns intoBreakneck Blitzand has base power100."
Vice Grip,Normal,Physical,55,100,30,true,1,Vise Gripdeals damage with no additional effect.,"When a Pokémon is holdingNormalium Zand uses its Z-Power,Vise Gripturns intoBreakneck Blitzand has base power100."
Giga Impact,Normal,Physical,150,90,5,true,4,"Giga Impactdeals damage, but the user must recharge on the next turn (bringing its effective power down to 75 per turn).","When a Pokémon is holdingNormalium Zand uses its Z-Power,Giga Impactturns intoBreakneck Blitzand has base power200.When Snorlax is holdingSnorlium Zand uses its Z-Power,Giga Impactturns intoPulverizing Pancakeand has base power210."
Bullet Punch,Steel,Physical,40,100,30,true,4,Bullet Punchdeals damage and has a priority of +1.,"When a Pokémon is holdingSteelium Zand uses its Z-Power,Bullet Punchturns intoCorkscrew Crashand has base power100."
Mystical Power,Psychic,Special,70,90,10,false,8,Mystical Powerdeals damage and raises the user's Special Attack by one stage.,
Inferno,Fire,Special,100,50,5,false,5,"Infernodeals damage and burns the target, if it hits. Burned Pokémon lose1⁄8of their maximum HP each turn and their Attack is decreased by 50%.","When a Pokémon is holdingFirium Zand uses its Z-Power,Infernoturns intoInferno Overdriveand has base power180."
Spider Web,Bug,Status,,,10,false,2,"Opponent cannot escape/switch.Z-Move effectsWhen a Pokémon is holdingBuginium Zand uses its Z-Power,Spider Webturns intoZ-Spider Weband raises Defense one stage, in addition to its usual effect as above.","When a Pokémon is holdingBuginium Zand uses its Z-Power,Spider Webturns intoZ-Spider Weband raises Defense one stage, in addition to its usual effect as above."
Triple Axel,Ice,Physical,20,90,10,true,8,A consecutive three-kick attack that becomes more powerful with each successful hit.,
Feint,Normal,Physical,30,100,10,false,4,"Feintonly hits if the target usedProtectorDetectin the same turn. It also cancels Protect/Detect for the remainder of the turn, so subsequent moves in the same turn (in double/triple battles) can still hit.","When a Pokémon is holdingNormalium Zand uses its Z-Power,Feintturns intoBreakneck Blitzand has base power100."
Bolt Beak,Electric,Physical,85,100,10,true,8,"If the user attacks before the target, the power of this move is doubled.",
Mirror Shot,Steel,Special,65,85,10,false,4,Mirror Shotdeals damage and has a 30% chance of lowering the target's Accuracy by one stage.,"When a Pokémon is holdingSteelium Zand uses its Z-Power,Mirror Shotturns intoCorkscrew Crashand has base power120."
Revenge,Fighting,Physical,60,100,10,true,3,"Power increases if user was hit first.Z-Move effectsWhen a Pokémon is holdingFightinium Zand uses its Z-Power,Revengeturns intoAll-Out Pummelingand has base power120.","When a Pokémon is holdingFightinium Zand uses its Z-Power,Revengeturns intoAll-Out Pummelingand has base power120."
Roar of Time,Dragon,Special,150,90,5,false,4,"User must recharge next turn.Z-Move effectsWhen a Pokémon is holdingDragonium Zand uses its Z-Power,Roar of Timeturns intoDevastating Drakeand has base power200.","When a Pokémon is holdingDragonium Zand uses its Z-Power,Roar of Timeturns intoDevastating Drakeand has base power200."
Obstruct,Dark,Status,,100,10,false,8,"Obstructprevents any attacks targeted at the user from striking, for the duration of the turn. If a contact move is targeted at the user on that turn, the attacker's Defense is lowered by two stages.",
Poison Sting,Poison,Physical,15,100,35,false,1,Poison Stingdeals damage and has a 30% chance of poisoning the target.,"When a Pokémon is holdingPoisonium Zand uses its Z-Power,Poison Stingturns intoAcid Downpourand has base power100."
Flash,Normal,Status,,100,20,false,1,Flashlowers the target's Accuracy by one stage.,"When a Pokémon is holdingNormalium Zand uses its Z-Power,Flashturns intoZ-Flashand raises Evasiveness one stage, in addition to its usual effect as above.Outside of battleFlashlights up dark caves. In the original games dark caves made the screen almost completely black, whereas in later games you can always see a very short distance around you;Flashmerely expands that circle. In the games it is an HM, it can only be used with the appropriate Gym Badge."
Hypnosis,Psychic,Status,,60,20,false,1,"Hypnosisputs the target to sleep, if it hits. Sleeping Pokémon cannot move (with some exceptions such asSnore). Sleep lasts for 1-3 turns.","When a Pokémon is holdingPsychium Zand uses its Z-Power,Hypnosisturns intoZ-Hypnosisand raises Speed one stage, in addition to its usual effect as above."
DynamicPunch,Fighting,Physical,100,50,5,true,2,"Dynamic Punchdeals damage and confuses the target, if it hits. Confused Pokémon have a 33% chance of hurting themselves each turn, for 1-4 attacking turns (50% chance inGenerations 1-6). The damage received is as if the Pokémon attacks itself with a typeless 40 base power Physical attack.","When a Pokémon is holdingFightinium Zand uses its Z-Power,Dynamic Punchturns intoAll-Out Pummelingand has base power180."
Tail Whip,Normal,Status,,100,30,false,1,Tail Whiplowers the target's Defense by one stage.,"When a Pokémon is holdingNormalium Zand uses its Z-Power,Tail Whipturns intoZ-Tail Whipand raises Attack one stage, in addition to its usual effect as above."
Fillet Away,Normal,Status,,,10,false,9,"Lowers HP but sharply boosts Attack, Special Attack, and Speed.",
Guard Split,Psychic,Status,,,10,false,5,Guard Splitaverages the user's Defense and Special Defense with those of the target. Stat boosts are not taken into account.,"When a Pokémon is holdingPsychium Zand uses its Z-Power,Guard Splitturns intoZ-Guard Splitand raises Speed one stage, in addition to its usual effect as above."
Gyro Ball,Steel,Physical,,100,5,true,4,"Gyro Ballinflicts varying damage: the slower the user compared to the opponent, the higher the damage, up to a maximum base power of150. The base power is calculated as:","When a Pokémon is holdingSteelium Zand uses its Z-Power,Gyro Ballturns intoCorkscrew Crashand has base power160."
Plasma Fists,Electric,Physical,100,100,15,true,7,"Changes Normal-type moves to Electric-type moves.Z-Move effectsWhen a Pokémon is holdingElectrium Zand uses its Z-Power,Plasma Fiststurns intoGigavolt Havocand has base power180.","When a Pokémon is holdingElectrium Zand uses its Z-Power,Plasma Fiststurns intoGigavolt Havocand has base power180."
Fire Fang,Fire,Physical,65,95,15,true,4,"Fire Fangdeals damage, has a 10% chance of burning the target and has a 10% chance of causing the target to flinch (if the target has not yet moved).","When a Pokémon is holdingFirium Zand uses its Z-Power,Fire Fangturns intoInferno Overdriveand has base power120."
Bulk Up,Fighting,Status,,,20,false,3,Bulk Upraises the user's Attack and Defense by one stage each.,"When a Pokémon is holdingFightinium Zand uses its Z-Power,Bulk Upturns intoZ-Bulk Upand raises Attack one stage, in addition to its usual effect as above."
Crabhammer,Water,Physical,100,90,10,true,1,Crabhammerdeals damage and has an increased critical hit ratio (1⁄8instead of1⁄24).,"When a Pokémon is holdingWaterium Zand uses its Z-Power,Crabhammerturns intoHydro Vortexand has base power180."
Parabolic Charge,Electric,Special,65,100,20,false,6,Parabolic Chargedeals damage and the user will recover 50% of the HP drained. It targets all adjacent Pokémon.,"When a Pokémon is holdingElectrium Zand uses its Z-Power,Parabolic Chargeturns intoGigavolt Havocand has base power120."
Baton Pass,Normal,Status,,,40,false,2,"Baton Passcauses the user to switch out for another Pokémon, passing any stat changes to the Pokémon that switches in. These effects are passed:","When a Pokémon is holdingNormalium Zand uses its Z-Power,Baton Passturns intoZ-Baton Passand eliminates any stat drops applied to the user, in addition to its usual effect as above."
Metal Sound,Steel,Status,,85,40,false,3,Metal Soundlowers the target's Special Defense by two stages.,"When a Pokémon is holdingSteelium Zand uses its Z-Power,Metal Soundturns intoZ-Metal Soundand raises Special Attack one stage, in addition to its usual effect as above."
Air Cutter,Flying,Special,60,95,25,false,3,Air Cutterdeals damage and has an increased critical hit ratio (1⁄8instead of1⁄24).,"When a Pokémon is holdingFlyinium Zand uses its Z-Power,Air Cutterturns intoSupersonic Skystrikeand has base power120."
Ally Switch,Psychic,Status,,,15,false,5,"Ally Switchswaps the user with its teammate. In triple battles the user must be on either end, not in the middle.","When a Pokémon is holdingPsychium Zand uses its Z-Power,Ally Switchturns intoZ-Ally Switchand raises Speed two stages, in addition to its usual effect as above."
Teeter Dance,Normal,Status,,100,20,false,3,Teeter Dancecauses all adjacent Pokémon to become confused. In single battles this is simply the opponent; in double/triple battles it includes all adjacent opponents and teammate(s).,"When a Pokémon is holdingNormalium Zand uses its Z-Power,Teeter Danceturns intoZ-Teeter Danceand raises Special Attack one stage, in addition to its usual effect as above."
Withdraw,Water,Status,,,40,false,1,Withdrawraises the user's Defense by one stage.,"When a Pokémon is holdingWaterium Zand uses its Z-Power,Withdrawturns intoZ-Withdrawand raises Defense one stage, in addition to its usual effect as above."
Pounce,Bug,Physical,50,100,20,true,9,Lowers opponent's Speed.							(100% chance),
Night Slash,Dark,Physical,70,100,15,true,4,Night Slashdeals damage and has an increased critical hit ratio (1⁄8instead of1⁄24).,"When a Pokémon is holdingDarkinium Zand uses its Z-Power,Night Slashturns intoBlack Hole Eclipseand has base power140."
Drill Run,Ground,Physical,80,95,10,true,5,Drill Rundeals damage and has an increased critical hit ratio (1⁄8instead of1⁄24).,"When a Pokémon is holdingGroundium Zand uses its Z-Power,Drill Runturns intoTectonic Rageand has base power160."
Frustration,Normal,Physical,,100,20,true,2,The power ofFrustrationis higher when the Pokémon likes its trainer less. The base power varies between1(maximum Friendship) and102(minimum Friendship). The exact formula is:,"When a Pokémon is holdingNormalium Zand uses its Z-Power,Frustrationturns intoBreakneck Blitzand has base power160."
Body Press,Fighting,Physical,80,100,10,true,8,"The higher the user's Defense, the stronger the attack.",
Weather Ball,Normal,Special,50,100,10,false,3,"The power and type ofWeather Ballchanges with the weather. With no weather condition it isNormaland has a base power of 50. If a weather condition is in effect, its power doubles to 100 and the move becomes a different type:","When a Pokémon is holdingNormalium Zand uses its Z-Power,Weather Ballturns intoBreakneck Blitzand has base power160."
Double Shock,Electric,Physical,120,100,5,true,9,"After using this move, the user will no longer be Electric type.",
Light Screen,Psychic,Status,,,30,false,1,"Light Screenreduces damage from Special attacks by 50%, for 5 turns. Its effects apply to all Pokémon on the user's side of the field.","When a Pokémon is holdingPsychium Zand uses its Z-Power,Light Screenturns intoZ-Light Screenand raises Special Defense one stage, in addition to its usual effect as above."
