move_name,type,category,power,accuracy,pp,makes_contact,introduced,effect,z_effect
Psychic Fangs,Psychic,Physical,85,100,10,true,7,"The user bites the target with its psychic capabilities. This can also destroy Light Screen and Reflect.Z-Move effectsWhen a Pokémon is holdingPsychium Zand uses its Z-Power,Psychic Fangsturns intoShattered Psycheand has base power160.","When a Pokémon is holdingPsychium Zand uses its Z-Power,Psychic Fangsturns intoShattered Psycheand has base power160."
Snipe Shot,Water,Special,80,100,15,false,8,Ignores moves and abilities that draw in moves. High critical hit ratio.,
Aqua Cutter,Water,Physical,70,100,20,false,9,Aqua Cutterdeals damage and has an increased critical-hit ratio.,
Rock Climb,Normal,Physical,90,85,20,true,4,Rock Climbdeals damage and has a 20% chance ofconfusingthe target.,"When a Pokémon is holdingNormalium Zand uses its Z-Power,Rock Climbturns intoBreakneck Blitzand has base power175.Outside of battleRock Climbcan be used to ascend rocky paths, inGeneration 4only. It can only be used with the appropriate Gym Badge."
Ember,Fire,Special,40,100,25,false,1,Emberdeals damage and has a 10% chance of burning the target.,"When a Pokémon is holdingFirium Zand uses its Z-Power,Emberturns intoInferno Overdriveand has base power100."
Pyro Ball,Fire,Physical,120,90,5,false,8,May burn opponent.							(10% chance),
Wonder Room,Psychic,Status,,,10,false,5,"Wonder Roomswitches the Defense and Special Defense of all Pokémon in battle, for 5 turns.","When a Pokémon is holdingPsychium Zand uses its Z-Power,Wonder Roomturns intoZ-Wonder Roomand raises Special Defense one stage, in addition to its usual effect as above."
Aqua Step,Water,Physical,80,100,10,true,9,Raises user's Speed.							(100% chance),
Frenzy Plant,Grass,Special,150,90,5,false,3,"User must recharge next turn.Z-Move effectsWhen a Pokémon is holdingGrassium Zand uses its Z-Power,Frenzy Plantturns intoBloom Doomand has base power200.","When a Pokémon is holdingGrassium Zand uses its Z-Power,Frenzy Plantturns intoBloom Doomand has base power200."
Blast Burn,Fire,Special,150,90,5,false,3,"User must recharge next turn.Z-Move effectsWhen a Pokémon is holdingFirium Zand uses its Z-Power,Blast Burnturns intoInferno Overdriveand has base power200.","When a Pokémon is holdingFirium Zand uses its Z-Power,Blast Burnturns intoInferno Overdriveand has base power200."
Acrobatics,Flying,Physical,55,100,15,true,5,"Acrobaticsdeals damage, however, if the user is not holding an item, its power doubles to110.","When a Pokémon is holdingFlyinium Zand uses its Z-Power,Acrobaticsturns intoSupersonic Skystrikeand has base power100."
Smokescreen,Normal,Status,,100,20,false,1,Smokescreenlowers the target's Accuracy by one stage.,"When a Pokémon is holdingNormalium Zand uses its Z-Power,Smokescreenturns intoZ-Smokescreenand raises Evasiveness one stage, in addition to its usual effect as above."
Rolling Kick,Fighting,Physical,60,85,15,true,1,Rolling Kickdeals damage and has a 30% chance of causing the target to flinch (if the target has not yet moved).,"When a Pokémon is holdingFightinium Zand uses its Z-Power,Rolling Kickturns intoAll-Out Pummelingand has base power120."
Karate Chop,Fighting,Physical,50,100,25,true,1,Karate Chopdeals damage and has an increased critical hit ratio (1⁄8instead of1⁄24).,"When a Pokémon is holdingFightinium Zand uses its Z-Power,Karate Chopturns intoAll-Out Pummelingand has base power100."
ThunderShock,Electric,Special,40,100,30,false,1,Thunder Shockdeals damage and has a 10% chance of paralyzing the target.,"When a Pokémon is holdingElectrium Zand uses its Z-Power,Thunder Shockturns intoGigavolt Havocand has base power100."
Diamond Storm,Rock,Physical,100,95,5,false,6,Diamond Stormdeals damage and has a 50% chance of raising the user's Defense by two stages.,"When a Pokémon is holdingRockium Zand uses its Z-Power,Diamond Stormturns intoContinental Crushand has base power180."
Pika Papow,Electric,Special,,,20,false,7,"Pika Papowis a Pikachu-exclusivePartner Powerfrom Pokémon Let's Go. The power increases when Pikachu's Friendship is higher (similar toReturn), up to a maximum base power of102.",
Conversion,Normal,Status,,,30,false,1,Conversionchanges the user's type to the same type as the first move in the Pokémon's move list.,"When a Pokémon is holdingNormalium Zand uses its Z-Power,Conversionturns intoZ-Conversionand raises all stats one stage each, in addition to its usual effect as above."
Brave Bird,Flying,Physical,120,100,15,true,4,"Brave Birddeals damage, but the user receives1⁄3of the damage it inflicted in recoil. In other words, if the attack does 90 HP damage to the opponent, the user will lose 30 HP.","When a Pokémon is holdingFlyinium Zand uses its Z-Power,Brave Birdturns intoSupersonic Skystrikeand has base power190."
Court Change,Normal,Status,,100,10,false,8,Swaps the effects on either side of the field.,
Wring Out,Normal,Special,,100,5,true,4,Wring Outinflicts more damage when the opponent's HP is higher. At full HP its base power is120and it decreases in proportion - i.e. the power is:,"When a Pokémon is holdingNormalium Zand uses its Z-Power,Wring Outturns intoBreakneck Blitzand has base power190."
Mega Punch,Normal,Physical,80,85,20,true,1,Mega Punchdeals damage with no additional effect.,"When a Pokémon is holdingNormalium Zand uses its Z-Power,Mega Punchturns intoBreakneck Blitzand has base power160."
Silver Wind,Bug,Special,60,100,5,false,3,"Silver Winddeals damage and has a 10% chance of raising the user's Attack, Defense, Special Attack, Special DefenseandSpeed by one stage each.","When a Pokémon is holdingBuginium Zand uses its Z-Power,Silver Windturns intoSavage Spin-Outand has base power120."
Faint Attack,Dark,Physical,60,,20,true,2,"Feint Attackdeals damage and ignores changes to the Accuracy and Evasion stats. However, it will not hit Pokémon during the invulnerable stage ofBounce,Dig,Dive,Fly,Phantom Force,Shadow ForceorSky Drop.","When a Pokémon is holdingDarkinium Zand uses its Z-Power,Feint Attackturns intoBlack Hole Eclipseand has base power120."
Sticky Web,Bug,Status,,,20,false,6,"Sticky Websets up a sticky net around the opposing team, which lowers the Speed of Pokémon switching into battle by one stage.","When a Pokémon is holdingBuginium Zand uses its Z-Power,Sticky Webturns intoZ-Sticky Weband raises Speed one stage, in addition to its usual effect as above."
Self-Destruct,Normal,Physical,200,100,5,false,1,"Self-Destructdeals high damage, but causes the user to faint.","When a Pokémon is holdingNormalium Zand uses its Z-Power,Self-Destructturns intoBreakneck Blitzand has base power200."
Quiver Dance,Bug,Status,,,20,false,5,"Quiver Danceraises the user's Special Attack, Special Defense and Speed by one stage each.","When a Pokémon is holdingBuginium Zand uses its Z-Power,Quiver Danceturns intoZ-Quiver Danceand eliminates any stat drops applied to the user, in addition to its usual effect as above."
Petal Dance,Grass,Special,120,100,10,true,1,"The user ofPetal Danceattacks for 2-3 turns, during which it cannot switch out, and then becomes confused. Confused Pokémon have a 33% chance of hurting themselves each turn, for 1-4 attacking turns (50% chance inGenerations 1-6). The damage received is as if the Pokémon attacks itself with a typeless 40 base power Physical attack.","When a Pokémon is holdingGrassium Zand uses its Z-Power,Petal Danceturns intoBloom Doomand has base power190."
Ice Beam,Ice,Special,90,100,10,false,1,Ice Beamdeals damage and has a 10% chance of freezing the target.,"When a Pokémon is holdingIcium Zand uses its Z-Power,Ice Beamturns intoSubzero Slammerand has base power175."
Matcha Gotcha,Grass,Special,80,90,15,false,9,The user fires a blast of tea that it mixed. The user's HP is restored by up to half the damage taken by the target. This may also leave the target with a burn.,
Psychic,Psychic,Special,90,100,10,false,1,Psychicdeals damage and has a 10% chance of lowering the target's Special Defense by one stage.,"When a Pokémon is holdingPsychium Zand uses its Z-Power,Psychicturns intoShattered Psycheand has base power175.When Mew is holdingMewnium Zand uses its Z-Power,Psychicturns intoGenesis Supernovaand has base power185."
Seed Bomb,Grass,Physical,80,100,15,false,4,Seed Bombdeals damage with no additional effect.,"When a Pokémon is holdingGrassium Zand uses its Z-Power,Seed Bombturns intoBloom Doomand has base power160."
Haze,Ice,Status,,,30,false,1,"Resets all stat changes.Z-Move effectsWhen a Pokémon is holdingIcium Zand uses its Z-Power,Hazeturns intoZ-Hazeand fully restores the user's HP, in addition to its usual effect as above.","When a Pokémon is holdingIcium Zand uses its Z-Power,Hazeturns intoZ-Hazeand fully restores the user's HP, in addition to its usual effect as above."
Oblivion Wing,Flying,Special,80,100,10,false,6,Oblivion Wingdeals damage and the user will recover 75% of the HP drained.,"When a Pokémon is holdingFlyinium Zand uses its Z-Power,Oblivion Wingturns intoSupersonic Skystrikeand has base power160."
Smelling Salts,Normal,Physical,70,100,10,true,3,"Smelling Saltsdeals damage, and hits with double power (140) if the target is paralyzed. However, it also cures the paralysis.","When a Pokémon is holdingNormalium Zand uses its Z-Power,Smelling Saltsturns intoBreakneck Blitzand has base power140."
Sketch,Normal,Status,,,1,false,2,"Permanently copies the opponent's last move.Z-Move effectsWhen a Pokémon is holdingNormalium Zand uses its Z-Power,Sketchturns intoZ-Sketchand raises all stats one stage each, in addition to its usual effect as above.","When a Pokémon is holdingNormalium Zand uses its Z-Power,Sketchturns intoZ-Sketchand raises all stats one stage each, in addition to its usual effect as above."
Minimize,Normal,Status,,,10,false,1,"Minimizeraises the user's Evasion by two stages, thus making the user more difficult to hit. Stats can be raised to a maximum of +6 stages each.","When a Pokémon is holdingNormalium Zand uses its Z-Power,Minimizeturns intoZ-Minimizeand eliminates any stat drops applied to the user, in addition to its usual effect as above."
Aerial Ace,Flying,Physical,60,,20,true,3,"Aerial Acedeals damage and ignores changes to the Accuracy and Evasion stats. However, it will not hit Pokémon during the invulnerable stage ofBounce,Dig,Dive,Fly,Shadow ForceorSky Drop.","When a Pokémon is holdingFlyinium Zand uses its Z-Power,Aerial Aceturns intoSupersonic Skystrikeand has base power120."
Tri Attack,Normal,Special,80,100,10,false,1,"Tri Attackdeals damage and has a 20% chance of paralyzing, burning or freezing the target - i.e. a 6.67% chance of each status condition.","When a Pokémon is holdingNormalium Zand uses its Z-Power,Tri Attackturns intoBreakneck Blitzand has base power160."
Mortal Spin,Poison,Physical,30,100,15,true,9,"Removes entry hazards and trap move effects, and poisons opposing Pokémon.",
Ivy Cudgel,Grass,Physical,100,,,false,9,Ivy Cudgeldeals damage and has an increased critical hit ratio (1⁄8instead of1⁄24). Its type changes based on the mask worn byOgerpon:,
Poison Jab,Poison,Physical,80,100,20,true,4,Poison Jabdeals damage and has a 30% chance of poisoning the target.,"When a Pokémon is holdingPoisonium Zand uses its Z-Power,Poison Jabturns intoAcid Downpourand has base power160."
Headlong Rush,Ground,Physical,120,100,5,true,8,"Headlong Rushdeals damage, but lowers the user's Defense and Special Defense stats by one stage each after attacking.",
Night Shade,Ghost,Special,,100,15,false,1,The damage ofNight Shadeis equal to the user's level. So at level 100 the Pokémon will inflict100 HPdamage.,"When a Pokémon is holdingGhostium Zand uses its Z-Power,Night Shadeturns intoNever-Ending Nightmareand has base power100."
Rock Wrecker,Rock,Physical,150,90,5,false,4,"User must recharge next turn.Z-Move effectsWhen a Pokémon is holdingRockium Zand uses its Z-Power,Rock Wreckerturns intoContinental Crushand has base power200.","When a Pokémon is holdingRockium Zand uses its Z-Power,Rock Wreckerturns intoContinental Crushand has base power200."
Tail Glow,Bug,Status,,,20,false,3,Tail Glowraises the user's Special Attack by three stages.,"When a Pokémon is holdingBuginium Zand uses its Z-Power,Tail Glowturns intoZ-Tail Glowand eliminates any stat drops applied to the user, in addition to its usual effect as above."
Wood Hammer,Grass,Physical,120,100,15,true,4,"Wood Hammerdeals damage, but the user receives1⁄3of the damage it inflicted in recoil. In other words, if the attack does 90 HP damage to the opponent, the user will lose 30 HP.","When a Pokémon is holdingGrassium Zand uses its Z-Power,Wood Hammerturns intoBloom Doomand has base power190."
Jaw Lock,Dark,Physical,80,100,10,true,8,Prevents user and opponent from switching out.,
Meteor Assault,Fighting,Physical,150,100,5,false,8,User must recharge next turn.,
Heat Wave,Fire,Special,95,90,10,false,3,Heat Wavedeals damage and has a 10% chance of burning the target.,"When a Pokémon is holdingFirium Zand uses its Z-Power,Heat Waveturns intoInferno Overdriveand has base power175."
Dive,Water,Physical,80,100,10,true,3,"The user ofDivewillhide underwateron the first turn, disappearing from view and becoming invulnerable to most attacks. On the second turn,Divedeals damage.","When a Pokémon is holdingWaterium Zand uses its Z-Power,Diveturns intoHydro Vortexand has base power160.Outside of battleWhile surfing, if you happen over a dark patch of water, you can dive below the surface and explore underwater. It can only be used with the appropriate Gym Badge.Two regions have areas where you can useDive:Hoenn(Ruby, Sapphire, Emerald, and the remakes Omega Ruby & Alpha Sapphire) andUnova(Black, White, Black 2, White 2) and the move is an HM in those games."
Techno Blast,Normal,Special,120,100,5,false,5,Techno Blastdeals damage. Its type changes depending on the held Drive:,"When a Pokémon is holdingNormalium Zand uses its Z-Power,Techno Blastturns intoBreakneck Blitzand has base power190."
Geomancy,Fairy,Status,,,10,false,6,"Geomancycharges on the first turn. On the second turn it raises the user's Special Attack, Special Defense and Speed by two stages each.","When a Pokémon is holdingFairium Zand uses its Z-Power,Geomancyturns intoZ-Geomancyand raises all stats one stage each, in addition to its usual effect as above."
Clangorous Soul,Dragon,Status,,100,5,false,8,Raises all user's stats but loses HP.							(100% chance),
Slam,Normal,Physical,80,75,20,true,1,Slamdeals damage with no additional effect.,"When a Pokémon is holdingNormalium Zand uses its Z-Power,Slamturns intoBreakneck Blitzand has base power160."
Baneful Bunker,Poison,Status,,,10,false,7,"Baneful Bunkerprevents any attacks targeted at the user from striking, for the duration of the turn. If a contact move is targeted at theBaneful Bunkeruser on that turn, the attacker becomes poisoned. It has priority +4 so will activate before most other moves.","When a Pokémon is holdingPoisonium Zand uses its Z-Power,Baneful Bunkerturns intoZ-Baneful Bunkerand raises Defense one stage, in addition to its usual effect as above."
Liquidation,Water,Physical,85,100,10,true,7,"May lower opponent's Defense.							(20% chance)Z-Move effectsWhen a Pokémon is holdingWaterium Zand uses its Z-Power,Liquidationturns intoHydro Vortexand has base power160.","When a Pokémon is holdingWaterium Zand uses its Z-Power,Liquidationturns intoHydro Vortexand has base power160."
Flip Turn,Water,Physical,60,100,20,true,8,"After making its attack, the user rushes back to switch places with a party Pokémon in waiting.",
Drum Beating,Grass,Physical,80,100,10,false,8,Lowers opponent's Speed.							(100% chance),
Close Combat,Fighting,Physical,120,100,5,true,4,Close Combatdeals damage but lowers the user's Defense and Special Defense by one stage each after attacking.,"When a Pokémon is holdingFightinium Zand uses its Z-Power,Close Combatturns intoAll-Out Pummelingand has base power190."
Spirit Shackle,Ghost,Physical,80,100,10,false,7,"Spirit Shackledeals damage and prevents the target from switching out, while the user remains in battle.","When a Pokémon is holdingGhostium Zand uses its Z-Power,Spirit Shackleturns intoNever-Ending Nightmareand has base power160.When Decidueye is holdingDecidium Zand uses its Z-Power,Spirit Shackleturns intoSinister Arrow Raidand has base power180."
Charge,Electric,Status,,,20,false,3,"Chargeraises the user's Special Defense by one stage, and if this Pokémon's next move is a damage-dealing Electric-type attack, it will deal double damage.","When a Pokémon is holdingElectrium Zand uses its Z-Power,Chargeturns intoZ-Chargeand raises Special Defense one stage, in addition to its usual effect as above."
Fell Stinger,Bug,Physical,50,100,25,true,6,"Fell Stingerdeals damage, and if the target is knocked out by this move, the user's Attack is raised by three stages.","When a Pokémon is holdingBuginium Zand uses its Z-Power,Fell Stingerturns intoSavage Spin-Outand has base power100."
Frost Breath,Ice,Special,60,90,10,false,5,"Frost Breathdeals damage and always results in a critical hit, increasing its power to90.","When a Pokémon is holdingIcium Zand uses its Z-Power,Frost Breathturns intoSubzero Slammerand has base power120."
Grass Pledge,Grass,Special,80,100,10,false,5,"Grass Pledgedeals damage at base power80. If a teammate usesFire PledgeorWater Pledgein the same turn, the moves combine into one attack of base power160and added effects appear.","When a Pokémon is holdingGrassium Zand uses its Z-Power,Grass Pledgeturns intoBloom Doomand has base power160."
Poison Powder,Poison,Status,,75,35,false,1,Poison Powdercauses the target to become poisoned. Poisoned Pokémon lose1⁄8of their maximum HP each turn.,"When a Pokémon is holdingPoisonium Zand uses its Z-Power,Poison Powderturns intoZ-Poison Powderand raises Defense one stage, in addition to its usual effect as above."
Iron Tail,Steel,Physical,100,75,15,true,2,Iron Taildeals damage and has a 30% chance of lowering the target's Defense by one stage.,"When a Pokémon is holdingSteelium Zand uses its Z-Power,Iron Tailturns intoCorkscrew Crashand has base power180."
Body Slam,Normal,Physical,85,100,15,true,1,Body Slamdeals damage and has a 30% chance of paralyzing the target.,"When a Pokémon is holdingNormalium Zand uses its Z-Power,Body Slamturns intoBreakneck Blitzand has base power160."
SonicBoom,Normal,Special,,90,20,false,1,"Sonic Boomalways deals 20 HP damage to the target, regardless of typing (althoughGhosttype Pokémon are still immune). It has no additional effect.","When a Pokémon is holdingNormalium Zand uses its Z-Power,Sonic Boomturns intoBreakneck Blitzand has base power100."
Fling,Dark,Physical,,100,10,false,4,"Power depends on held item.Z-Move effectsWhen a Pokémon is holdingDarkinium Zand uses its Z-Power,Flingturns intoBlack Hole Eclipseand has base power100.","When a Pokémon is holdingDarkinium Zand uses its Z-Power,Flingturns intoBlack Hole Eclipseand has base power100."
Spore,Grass,Status,,100,15,false,1,Sporeputs the target to sleep. Sleeping Pokémon cannot move (with some exceptions such asSnore). Sleep lasts for 1-3 turns.,"When a Pokémon is holdingGrassium Zand uses its Z-Power,Sporeturns intoZ-Sporeand eliminates any stat drops applied to the user, in addition to its usual effect as above."
Razor Leaf,Grass,Physical,55,95,25,false,1,Razor Leafdeals damage and has an increased critical hit ratio (1⁄8instead of1⁄24).,"When a Pokémon is holdingGrassium Zand uses its Z-Power,Razor Leafturns intoBloom Doomand has base power100."
Final Gambit,Fighting,Special,,100,5,false,5,"Inflicts damage equal to the user's remaining HP. User faints.Z-Move effectsWhen a Pokémon is holdingFightinium Zand uses its Z-Power,Final Gambitturns intoAll-Out Pummelingand has base power180.","When a Pokémon is holdingFightinium Zand uses its Z-Power,Final Gambitturns intoAll-Out Pummelingand has base power180."
Steel Roller,Steel,Physical,130,100,5,true,8,The user attacks while destroying the terrain. This move fails when the ground hasn’t turned into a terrain.,
Heart Stamp,Psychic,Physical,60,100,25,true,5,Heart Stampdeals damage and has a 30% chance of causing the target to flinch (if the target has not yet moved).,"When a Pokémon is holdingPsychium Zand uses its Z-Power,Heart Stampturns intoShattered Psycheand has base power120."
Psystrike,Psychic,Special,100,100,10,false,5,"Inflicts damage based on the target's Defense, not Special Defense.Z-Move effectsWhen a Pokémon is holdingPsychium Zand uses its Z-Power,Psystriketurns intoShattered Psycheand has base power180.","When a Pokémon is holdingPsychium Zand uses its Z-Power,Psystriketurns intoShattered Psycheand has base power180."
Magnitude,Ground,Physical,,100,30,false,2,"The base power ofMagnitudeis one of 7 random values, with varying probability, as shown in the table.","When a Pokémon is holdingGroundium Zand uses its Z-Power,Magnitudeturns intoTectonic Rageand has base power140."
Spotlight,Normal,Status,,,15,false,7,"The user shines a spotlight on the target so that only the target will be attacked during the turn.Z-Move effectsWhen a Pokémon is holdingNormalium Zand uses its Z-Power,Spotlightturns intoZ-Spotlightand raises Special Defense one stage, in addition to its usual effect as above.","When a Pokémon is holdingNormalium Zand uses its Z-Power,Spotlightturns intoZ-Spotlightand raises Special Defense one stage, in addition to its usual effect as above."
Power Trip,Dark,Physical,20,100,10,true,7,"The user boasts its strength and attacks the target. The more the user's stats are raised, the greater the move's power.Z-Move effectsWhen a Pokémon is holdingDarkinium Zand uses its Z-Power,Power Tripturns intoBlack Hole Eclipseand has base power160.","When a Pokémon is holdingDarkinium Zand uses its Z-Power,Power Tripturns intoBlack Hole Eclipseand has base power160."
Sonic Boom,Normal,Special,,90,20,false,1,"Sonic Boomalways deals 20 HP damage to the target, regardless of typing (althoughGhosttype Pokémon are still immune). It has no additional effect.","When a Pokémon is holdingNormalium Zand uses its Z-Power,Sonic Boomturns intoBreakneck Blitzand has base power100."
Synchronoise,Psychic,Special,120,100,10,false,5,"Synchronoisehits all adjacent Pokémon that share a type with the user. Dual type Pokémon match either of their types, so for example a Normal/Flying Pokémon usingSynchronoisewill hit a Flying/Dragon type.","When a Pokémon is holdingPsychium Zand uses its Z-Power,Synchronoiseturns intoShattered Psycheand has base power190."
Psyshield Bash,Psychic,Physical,70,90,10,true,8,Psyshield Bashdeals damage and raises the user's Defense by one stage.,
Aqua Ring,Water,Status,,,20,false,4,"The user ofAqua Ringsurrounds itself with a veil of water,which restores1⁄16of its maximum HP at the end of each turn.","When a Pokémon is holdingWaterium Zand uses its Z-Power,Aqua Ringturns intoZ-Aqua Ringand raises Defense one stage, in addition to its usual effect as above."
Hone Claws,Dark,Status,,,15,false,5,Hone Clawsraises the user's Attack and Accuracy by one stage each.,"When a Pokémon is holdingDarkinium Zand uses its Z-Power,Hone Clawsturns intoZ-Hone Clawsand raises Attack one stage, in addition to its usual effect as above."
Rock Blast,Rock,Physical,25,90,10,false,3,"Rock Blasthits 2-5 times per turn used. The probability of each interval is shown in the table, with the total power after each hit.","When a Pokémon is holdingRockium Zand uses its Z-Power,Rock Blastturns intoContinental Crushand has base power140."
Conversion 2,Normal,Status,,,30,false,2,"Conversion 2changes the user's type to one that is resistant (or immune) to the last move used by the target, randomly.","When a Pokémon is holdingNormalium Zand uses its Z-Power,Conversion 2turns intoZ-Conversion 2and fully restores the user's HP, in addition to its usual effect as above."
Lunar Blessing,Psychic,Status,,,5,false,8,"Lunar Blessingheals all status conditions of the user and its teammates, and restores 25% of their maximum HP.",
Parting Shot,Dark,Status,,100,20,false,6,"Parting Shotlowers the opponent's Attack and Special Attack by one stage each, then the user switches out of battle.","When a Pokémon is holdingDarkinium Zand uses its Z-Power,Parting Shotturns intoZ-Parting Shotand fully restores the HP of the Pokémon switching in, in addition to its usual effect as above."
Accelerock,Rock,Physical,40,100,20,true,7,Accelerockdeals damage and has high priority.,"When a Pokémon is holdingRockium Zand uses its Z-Power,Accelerockturns intoContinental Crushand has base power100."
Blizzard,Ice,Special,110,70,5,false,1,Blizzarddeals damage and has a 10% chance of freezing the target. It will hit both opponents in a double battle or adjacent opponents in a triple battle.,"When a Pokémon is holdingIcium Zand uses its Z-Power,Blizzardturns intoSubzero Slammerand has base power185."
Electric Terrain,Electric,Status,,,10,false,6,"Electric Terraincreates a low-lying electric field lasting 5 turns, that prevents grounded Pokémon from falling asleep. The power ofElectrictype moves also increases by 50% while in effect.","When a Pokémon is holdingElectrium Zand uses its Z-Power,Electric Terrainturns intoZ-Electric Terrainand raises Speed one stage, in addition to its usual effect as above."
Gust,Flying,Special,40,100,35,false,1,"Gustdeals damage and can hit Pokémon during the invulnerable stage ofBounce,FlyorSky Drop- in which case the power is doubled.","When a Pokémon is holdingFlyinium Zand uses its Z-Power,Gustturns intoSupersonic Skystrikeand has base power100."
