move_name,type,category,power,accuracy,pp,makes_contact,introduced,effect,z_effect
Defog,Flying,Status,,,15,false,4,"Defoglowers the target's Evasion by one stage and removes entry hazards and barriers on both sides of the field. The moves affected are:Light Screen,Reflect,Mist,Safeguard,Spikes,Stealth Rock,Sticky WebandToxic Spikes.","When a Pokémon is holdingFlyinium Zand uses its Z-Power,Defogturns intoZ-Defogand raises Accuracy one stage, in addition to its usual effect as above.Outside of battleDefogcan be used to clear foggy areas (fog will return upon leaving and re-entering the area). So far only Sinnoh has experienced foggy weather. In Diamond & Pearl,Defogcannot be used outside of battle before obtaining the Fen Badge (Pastoria City Gym); In Platinum it cannot be used before the Relic Badge (Hearthome City Gym)."
Twineedle,Bug,Physical,25,100,20,false,1,"Twineedledeals damage and will strike twice (with 25 base power each time). It has a 20% chance of poisoning the target.PoisonorSteeltype Pokémon, those with the abilityImmunityor those behind aSubstitutecannot be poisoned.","When a Pokémon is holdingBuginium Zand uses its Z-Power,Twineedleturns intoSavage Spin-Outand has base power100."
Waterfall,Water,Physical,80,100,15,true,1,Waterfalldeals damage and has a 20% chance of causing the target to flinch (if the target has not yet moved).,"When a Pokémon is holdingWaterium Zand uses its Z-Power,Waterfallturns intoHydro Vortexand has base power160.Outside of battleAllows a surfing Pokémon to ascend a waterfall. In Diamond, Pearl & Platinum,Waterfallis required to descend waterfalls, but in other games it is not."
Charm,Fairy,Status,,100,20,false,2,Charmlowers the target's Attack by two stages.,"When a Pokémon is holdingFairium Zand uses its Z-Power,Charmturns intoZ-Charmand raises Defense one stage, in addition to its usual effect as above."
Imprison,Psychic,Status,,,10,false,3,"Opponent is unable to use moves that the user also knows.Z-Move effectsWhen a Pokémon is holdingPsychium Zand uses its Z-Power,Imprisonturns intoZ-Imprisonand raises Special Defense two stages, in addition to its usual effect as above.","When a Pokémon is holdingPsychium Zand uses its Z-Power,Imprisonturns intoZ-Imprisonand raises Special Defense two stages, in addition to its usual effect as above."
Bouncy Bubble,Water,Special,90,100,15,false,7,Bouncy Bubbledeals damage and heals the user for half the damage dealt to the opponent.,
Cut,Normal,Physical,50,95,30,true,1,Cutdeals damage with no additional effect in battle.,"When a Pokémon is holdingNormalium Zand uses its Z-Power,Cutturns intoBreakneck Blitzand has base power100.Outside of battleCutis used to tear down small trees in your path. InGenerations 1-6it can only be used with the appropriate Gym Badge.InGenerations 1-3,Cutcan also remove patches of grass. In Emerald, Pokémon with theHyper Cutterability remove a larger patch of grass."
Dig,Ground,Physical,80,100,10,true,1,"The user ofDigwillburrow its way undergroundon the first turn, disappearing from view and becoming invulnerable to most attacks. On the second turn,Digdeals damage.","When a Pokémon is holdingGroundium Zand uses its Z-Power,Digturns intoTectonic Rageand has base power160.Outside of battleDigcan be used to escape from caves. The player is returned to the location at which they entered, just like using anEscape Rope."
Vital Throw,Fighting,Physical,70,,10,true,2,"Vital Throwdeals damage with lower priority, so most attacks will take place before it.Vital Throwignores changes to the Accuracy and Evasion stats. However, it will not hit Pokémon during the invulnerable stage ofBounce,Dig,Dive,Fly,Phantom Force,Shadow ForceorSky Drop.","When a Pokémon is holdingFightinium Zand uses its Z-Power,Vital Throwturns intoAll-Out Pummelingand has base power140."
Seed Flare,Grass,Special,120,85,5,false,4,Seed Flaredeals damage and has a 40% chance of lowering the target's Special Defense by two stages.,"When a Pokémon is holdingGrassium Zand uses its Z-Power,Seed Flareturns intoBloom Doomand has base power190."
Sunsteel Strike,Steel,Physical,100,100,5,true,7,"Ignores the target's ability.Z-Move effectsWhen a Pokémon is holdingSteelium Zand uses its Z-Power,Sunsteel Striketurns intoCorkscrew Crashand has base power180.When Solgaleo or Dusk Mane Necrozma is holdingSolganium Zand uses its Z-Power,Sunsteel Striketurns intoSearing Sunraze Smashand has base power200.","When a Pokémon is holdingSteelium Zand uses its Z-Power,Sunsteel Striketurns intoCorkscrew Crashand has base power180.When Solgaleo or Dusk Mane Necrozma is holdingSolganium Zand uses its Z-Power,Sunsteel Striketurns intoSearing Sunraze Smashand has base power200."
Toxic Thread,Poison,Status,,100,20,false,7,"Toxic Threadpoisons the target, and lowers its Speed by one stage.","When a Pokémon is holdingPoisonium Zand uses its Z-Power,Toxic Threadturns intoZ-Toxic Threadand raises Speed one stage, in addition to its usual effect as above."
Raging Fury,Fire,Physical,120,100,10,false,8,"The user ofRaging Furyattacks for 2-3 turns, during which it cannot switch out, and then becomes confused. Confused Pokémon have a 33% chance of hurting themselves each turn, for 1-4 attacking turns (50% chance inGenerations 1-6). The damage received is as if the Pokémon attacks itself with a typeless 40 base power Physical attack.",
Thousand Waves,Ground,Physical,90,100,10,false,6,"Thousand Wavesdeals damage and prevents the target(s) from fleeing or switching out, as long as the user remains in battle.","When a Pokémon is holdingGroundium Zand uses its Z-Power,Thousand Wavesturns intoTectonic Rageand has base power175."
Draining Kiss,Fairy,Special,50,100,10,true,6,Draining Kissdeals damage and the user will recover 75% of the HP drained.,"When a Pokémon is holdingFairium Zand uses its Z-Power,Draining Kissturns intoTwinkle Tackleand has base power100."
Magnet Rise,Electric,Status,,,10,false,4,"User becomes immune to Ground-type moves for 5 turns.Z-Move effectsWhen a Pokémon is holdingElectrium Zand uses its Z-Power,Magnet Riseturns intoZ-Magnet Riseand raises Evasiveness one stage, in addition to its usual effect as above.","When a Pokémon is holdingElectrium Zand uses its Z-Power,Magnet Riseturns intoZ-Magnet Riseand raises Evasiveness one stage, in addition to its usual effect as above."
Aqua Tail,Water,Physical,90,90,10,true,4,Aqua Taildeals damage with no additional effect.,"When a Pokémon is holdingWaterium Zand uses its Z-Power,Aqua Tailturns intoHydro Vortexand has base power175."
Shadow Punch,Ghost,Physical,60,,20,true,3,"Shadow Punchdeals damage and ignores changes to the Accuracy and Evasion stats. However, it will not hit Pokémon during the invulnerable stage ofBounce,Dig,Dive,Fly,Phantom Force,Shadow ForceorSky Drop.","When a Pokémon is holdingGhostium Zand uses its Z-Power,Shadow Punchturns intoNever-Ending Nightmareand has base power120."
Shell Side Arm,Poison,Special,90,100,10,false,8,"May poison opponent. Inflicts either Special or Physical damage, whichever is better.",
Tickle,Normal,Status,,100,20,false,3,Ticklelowers the target's Attack and Defense by one stage each.,"When a Pokémon is holdingNormalium Zand uses its Z-Power,Tickleturns intoZ-Tickleand raises Defense one stage, in addition to its usual effect as above."
Constrict,Normal,Physical,10,100,35,true,1,Constrictdeals damage and has a 10% chance of lowering the target's Speed by one stage.,"When a Pokémon is holdingNormalium Zand uses its Z-Power,Constrictturns intoBreakneck Blitzand has base power100."
Head Charge,Normal,Physical,120,100,15,true,5,"Head Chargedeals damage, but the user receives1⁄4of the damage it inflicts in recoil. In other words, if the attack does 100 HP damage to the opponent, the user will lose 25 HP.","When a Pokémon is holdingNormalium Zand uses its Z-Power,Head Chargeturns intoBreakneck Blitzand has base power190."
Grassy Glide,Grass,Physical,55,100,20,true,8,"High priority during Grassy Terrain.ChangesInGeneration 8,Grassy Glidehas 70 base power.",
Crush Grip,Normal,Physical,,100,5,true,4,Crush Gripinflicts more damage when the opponent's HP is higher. At full HP its base power is120and it decreases in proportion - i.e. the power is:,"When a Pokémon is holdingNormalium Zand uses its Z-Power,Crush Gripturns intoBreakneck Blitzand has base power190."
Shell Trap,Fire,Special,150,100,5,false,7,"Shell Trapsets a trap at the beginning of the turn, and if the user is hit by a physical move during the turn, it deals high damage to the opponent.","When a Pokémon is holdingFirium Zand uses its Z-Power,Shell Trapturns intoInferno Overdriveand has base power200."
Slash,Normal,Physical,70,100,20,true,1,Slashdeals damage and has an increased critical hit ratio (1⁄8instead of1⁄24).,"When a Pokémon is holdingNormalium Zand uses its Z-Power,Slashturns intoBreakneck Blitzand has base power140."
Sizzly Slide,Fire,Physical,90,100,15,true,7,Sizzly Slidedeals damage and burns the opponent.,
Water Spout,Water,Special,150,100,5,false,3,Water Spoutinflicts more damage when the user's HP is higher. At full HP its base power is150and it decreases in proportion - i.e. the power is:,"When a Pokémon is holdingWaterium Zand uses its Z-Power,Water Spoutturns intoHydro Vortexand has base power200."
Sky Drop,Flying,Physical,60,100,10,true,5,"Sky Droptakes the target into the air on the first turn, then drops them on the second turn, wherein they receive damage.","When a Pokémon is holdingFlyinium Zand uses its Z-Power,Sky Dropturns intoSupersonic Skystrikeand has base power120."
Sludge,Poison,Special,65,100,20,false,1,Sludgedeals damage and has a 30% chance of poisoning the target.,"When a Pokémon is holdingPoisonium Zand uses its Z-Power,Sludgeturns intoAcid Downpourand has base power120."
Tar Shot,Rock,Status,,100,15,false,8,Lowers the opponent's Speed and makes them weaker to Fire-type moves.							(100% chance),
Expanding Force,Psychic,Special,80,100,10,false,8,The user attacks the target with its psychic power. This move’s power goes up and damages all opposing Pokémon on Psychic Terrain.,
Thunder Shock,Electric,Special,40,100,30,false,1,Thunder Shockdeals damage and has a 10% chance of paralyzing the target.,"When a Pokémon is holdingElectrium Zand uses its Z-Power,Thunder Shockturns intoGigavolt Havocand has base power100."
Bolt Strike,Electric,Physical,130,85,5,true,5,Bolt Strikedeals damage and has a 20% chance of paralyzing the target.,"When a Pokémon is holdingElectrium Zand uses its Z-Power,Bolt Striketurns intoGigavolt Havocand has base power195."
Tailwind,Flying,Status,,,15,false,4,Tailwinddoubles the speed of all Pokémon in the user's party for 4 turns.,"When a Pokémon is holdingFlyinium Zand uses its Z-Power,Tailwindturns intoZ-Tailwindand raises critical-hit ratio one stage, in addition to its usual effect as above."
Ice Hammer,Ice,Physical,100,90,10,true,7,"The user swings and hits with its strong, heavy fist. It lowers the user's Speed, however.							(100% chance)Z-Move effectsWhen a Pokémon is holdingIcium Zand uses its Z-Power,Ice Hammerturns intoSubzero Slammerand has base power180.","When a Pokémon is holdingIcium Zand uses its Z-Power,Ice Hammerturns intoSubzero Slammerand has base power180."
X-Scissor,Bug,Physical,80,100,15,true,4,X-Scissordeals damage with no additional effect.,"When a Pokémon is holdingBuginium Zand uses its Z-Power,X-Scissorturns intoSavage Spin-Outand has base power160."
Throat Chop,Dark,Physical,80,100,15,true,7,Throat Chopdeals damage and prevents the target from using sound-based moves such asHyper Voicefor two turns.,"When a Pokémon is holdingDarkinium Zand uses its Z-Power,Throat Chopturns intoBlack Hole Eclipseand has base power160."
First Impression,Bug,Physical,90,100,10,true,7,"Although this move has great power, it only works the first turn the user is in battle.Z-Move effectsWhen a Pokémon is holdingBuginium Zand uses its Z-Power,First Impressionturns intoSavage Spin-Outand has base power175.","When a Pokémon is holdingBuginium Zand uses its Z-Power,First Impressionturns intoSavage Spin-Outand has base power175."
Mirror Coat,Psychic,Special,,100,20,false,2,"When hit by a Special Attack, user strikes back with 2x power.Z-Move effectsWhen a Pokémon is holdingPsychium Zand uses its Z-Power,Mirror Coatturns intoShattered Psycheand has base power100.","When a Pokémon is holdingPsychium Zand uses its Z-Power,Mirror Coatturns intoShattered Psycheand has base power100."
Play Nice,Normal,Status,,,20,false,6,"Play Nicelowers the target's Attack by one stage. The move always hits, even if the target used aProtect-like move.","When a Pokémon is holdingNormalium Zand uses its Z-Power,Play Niceturns intoZ-Play Niceand raises Defense one stage, in addition to its usual effect as above."
Double-Edge,Normal,Physical,120,100,15,true,1,"Double-Edgedeals damage, but the user receives1⁄3of the damage it inflicted in recoil. In other words, if the attack does 90 HP damage to the opponent, the user will lose 30 HP.","When a Pokémon is holdingNormalium Zand uses its Z-Power,Double-Edgeturns intoBreakneck Blitzand has base power190."
Healing Wish,Psychic,Status,,,10,false,4,"The user faints and the next Pokémon released is fully healed.Z-Move effectsWhen a Pokémon is holdingPsychium Zand uses its Z-Power,Healing Wishhas no additional effect.","When a Pokémon is holdingPsychium Zand uses its Z-Power,Healing Wishhas no additional effect."
Sparkly Swirl,Fairy,Special,90,100,15,false,7,Sparkly Swirldeals damage and heals all status conditions of the user's party Pokémon (similar toAromatherapy).,
Dragon Pulse,Dragon,Special,85,100,10,false,4,Dragon Pulsedeals damage with no additional effect.,"When a Pokémon is holdingDragonium Zand uses its Z-Power,Dragon Pulseturns intoDevastating Drakeand has base power160."
Thunder,Electric,Special,110,70,10,false,1,Thunderdeals damage and has a 30% chance of paralyzing the target.,"When a Pokémon is holdingElectrium Zand uses its Z-Power,Thunderturns intoGigavolt Havocand has base power185."
Rototiller,Ground,Status,,,10,false,6,Rototillerraises the Attack and Special Attack of any Grass-type Pokémon on the field by one stage each.,"When a Pokémon is holdingGroundium Zand uses its Z-Power,Rototillerturns intoZ-Rototillerand raises Attack one stage, in addition to its usual effect as above."
Stone Axe,Rock,Physical,65,90,15,true,8,"Stone Axedeals damage and scatters sharp rocks around the opposing field, likeStealth Rock, which damage opponents switching into battle.",
Darkest Lariat,Dark,Physical,85,100,10,true,7,"Darkest Lariatdeals damage, but ignores changes to the target's stats (i.e. Defense and Evasion in this case).","When a Pokémon is holdingDarkinium Zand uses its Z-Power,Darkest Lariatturns intoBlack Hole Eclipseand has base power160.When Incineroar is holdingIncinium Zand uses its Z-Power,Darkest Lariatturns intoMalicious Moonsaultand has base power180."
False Swipe,Normal,Physical,40,100,40,true,2,"Always leaves opponent with at least 1 HP.Z-Move effectsWhen a Pokémon is holdingNormalium Zand uses its Z-Power,False Swipeturns intoBreakneck Blitzand has base power100.","When a Pokémon is holdingNormalium Zand uses its Z-Power,False Swipeturns intoBreakneck Blitzand has base power100."
Psycho Shift,Psychic,Status,,100,10,false,4,"Psycho Shifttransfers any major status condition the user has (Poison, Burn, Paralysis, Sleep, Freeze) to the target, if the target does not already have a status condition.","When a Pokémon is holdingPsychium Zand uses its Z-Power,Psycho Shiftturns intoZ-Psycho Shiftand raises Special Attack two stages, in addition to its usual effect as above."
Embargo,Dark,Status,,100,15,false,4,Embargoprevents the target using any items for five turns. This includes both held items and items used by the trainer such as medicines.,"When a Pokémon is holdingDarkinium Zand uses its Z-Power,Embargoturns intoZ-Embargoand raises Special Attack one stage, in addition to its usual effect as above."
Pin Missile,Bug,Physical,25,95,20,false,1,"Pin Missilehits 2-5 times per turn used. The probability of each interval is shown in the table, with the total power after each hit.","When a Pokémon is holdingBuginium Zand uses its Z-Power,Pin Missileturns intoSavage Spin-Outand has base power140."
Growth,Normal,Status,,,20,false,1,Growthraises the user's Attack and Special Attack by one stage each. During harsh sunlight it raises each stat by two stages.,"When a Pokémon is holdingNormalium Zand uses its Z-Power,Growthturns intoZ-Growthand raises Special Attack one stage, in addition to its usual effect as above."
Energy Ball,Grass,Special,90,100,10,false,4,Energy Balldeals damage and has a 10% chance of lowering the target's Special Defense by one stage.,"When a Pokémon is holdingGrassium Zand uses its Z-Power,Energy Ballturns intoBloom Doomand has base power175."
Scary Face,Normal,Status,,100,10,false,2,Scary Facelowers the target's Speed by two stages.,"When a Pokémon is holdingNormalium Zand uses its Z-Power,Scary Faceturns intoZ-Scary Faceand raises Speed one stage, in addition to its usual effect as above."
Guard Swap,Psychic,Status,,,10,false,4,"User and opponent swap Defense and Special Defense.Z-Move effectsWhen a Pokémon is holdingPsychium Zand uses its Z-Power,Guard Swapturns intoZ-Guard Swapand raises Speed one stage, in addition to its usual effect as above.","When a Pokémon is holdingPsychium Zand uses its Z-Power,Guard Swapturns intoZ-Guard Swapand raises Speed one stage, in addition to its usual effect as above."
Toxic,Poison,Status,,90,10,false,1,Toxiccauses the target to bebadly poisoned.Pokémon that are badly poisoned will lose an increasing amount of HP at the end of each turn.,"When a Pokémon is holdingPoisonium Zand uses its Z-Power,Toxicturns intoZ-Toxicand raises Defense one stage, in addition to its usual effect as above."
Stone Edge,Rock,Physical,100,80,5,false,4,Stone Edgedeals damage and has an increased critical hit ratio (1⁄8instead of1⁄24).,"When a Pokémon is holdingRockium Zand uses its Z-Power,Stone Edgeturns intoContinental Crushand has base power180.When Lycanroc is holdingLycanium Zand uses its Z-Power,Stone Edgeturns intoSplintered Stormshardsand has base power190."
Misty Terrain,Fairy,Status,,,10,false,6,"Misty Terraincreates a low-lying mist lasting 5 turns, that protects all grounded Pokémon from status conditions (including confusion). It also halves the power ofDragontype moves while in effect.","When a Pokémon is holdingFairium Zand uses its Z-Power,Misty Terrainturns intoZ-Misty Terrainand raises Special Defense one stage, in addition to its usual effect as above."
Avalanche,Ice,Physical,60,100,10,true,4,"Power doubles if user took damage first.Z-Move effectsWhen a Pokémon is holdingIcium Zand uses its Z-Power,Avalancheturns intoSubzero Slammerand has base power120.","When a Pokémon is holdingIcium Zand uses its Z-Power,Avalancheturns intoSubzero Slammerand has base power120."
Glacial Lance,Ice,Physical,120,100,5,false,8,"The user attacks by hurling a blizzard-cloaked icicle lance at opposing Pokémon.ChangesIn Pokémon Legends: Arceus,Glacial Lancehas 130 base power.",
Memento,Dark,Status,,100,10,false,3,"User faints, sharply lowers opponent's Attack and Special Attack.ChangesInGeneration 3,Mementoalways hits.Z-Move effectsWhen a Pokémon is holdingDarkinium Zand uses its Z-Power,Mementoturns intoZ-Mementoand fully restores the HP of the Pokémon switching in, in addition to its usual effect as above.","When a Pokémon is holdingDarkinium Zand uses its Z-Power,Mementoturns intoZ-Mementoand fully restores the HP of the Pokémon switching in, in addition to its usual effect as above."
Confide,Normal,Status,,,20,false,6,Confidelowers the target's Special Attack by one stage.,"When a Pokémon is holdingNormalium Zand uses its Z-Power,Confideturns intoZ-Confideand raises Special Defense one stage, in addition to its usual effect as above."
Springtide Storm,Fairy,Special,100,80,5,false,8,Springtide Stormdeals damage and has a 30% chance of lowering the target's Attack by one stage. The move targets both opponents in a double battle (each with a 30% chance of lowering Attack).,
Aura Sphere,Fighting,Special,80,,20,false,4,"Aura Spheredeals damage and ignores changes to the Accuracy and Evasion stats. However, it will not hit Pokémon during the invulnerable stage ofBounce,Dig,Dive,Fly,Phantom Force,Shadow ForceorSky Drop.","When a Pokémon is holdingFightinium Zand uses its Z-Power,Aura Sphereturns intoAll-Out Pummelingand has base power160."
Poison Fang,Poison,Physical,50,100,15,true,3,Poison Fangdeals damage and has a 50% chance ofbadly poisoningthe target. Badly poisoned Pokémon will lose an increasing amount of HP at the end of each turn.,"When a Pokémon is holdingPoisonium Zand uses its Z-Power,Poison Fangturns intoAcid Downpourand has base power100."
Chatter,Flying,Special,65,100,20,false,4,"Chatterdeals damage and causes the target to become confused. Confused Pokémon have a 33% chance of hurting themselves each turn, for 1-4 attacking turns (50% chance inGenerations 1-6). The damage received is as if the Pokémon attacks itself with a typeless 40 base power Physical attack.","When a Pokémon is holdingFlyinium Zand uses its Z-Power,Chatterturns intoSupersonic Skystrikeand has base power120."
Hi Jump Kick,Fighting,Physical,130,90,10,true,1,"High Jump Kickdeals damage, however, if it misses the userkeeps going and crashes,losing1⁄2of its maximum HP.High Jump Kickcannot be used ifGravityis in effect.","When a Pokémon is holdingFightinium Zand uses its Z-Power,High Jump Kickturns intoAll-Out Pummelingand has base power195."
Echoed Voice,Normal,Special,40,100,15,false,5,"Echoed Voicedeals damage starting at base power 40, and increases by 40 each turn if used by any Pokémon on the field, up to a maximum base power of 200.","When a Pokémon is holdingNormalium Zand uses its Z-Power,Echoed Voiceturns intoBreakneck Blitzand has base power100."
Baddy Bad,Dark,Special,90,100,15,false,7,"Baddy Baddeals damage and reduces damage from Physical attacks by 50%, for 5 turns (similar toReflect).",
Swallow,Normal,Status,,,10,false,3,"Swallowrecovers a varying amount of HP depending on how many times the user has usedStockpile. It recovers 25%, 50% or 100% of the user's maximum HP if the user stockpiled one, two or three times respectively.","When a Pokémon is holdingNormalium Zand uses its Z-Power,Swallowturns intoZ-Swallowand eliminates any stat drops applied to the user, in addition to its usual effect as above."
Camouflage,Normal,Status,,,20,false,3,Camouflagecauses the user to change its type based on the current terrain:,"When a Pokémon is holdingNormalium Zand uses its Z-Power,Camouflageturns intoZ-Camouflageand raises Evasiveness one stage, in addition to its usual effect as above."
Order Up,Dragon,Physical,80,100,10,false,9,"Order Updeals damage. If the user, Dondozo, has aTatsugiriin its mouth, it also raises a particular stat depending on the form of Tatsugiri:",
Malignant Chain,Poison,Special,100,100,5,false,9,"The user pours toxins into the target by wrapping them in a toxic, corrosive chain. This may also leave the target badly poisoned.",
Moonlight,Fairy,Status,,,5,false,2,The user restores its own HP. The amount of HP regained varies with the weather.,"When a Pokémon is holdingFairium Zand uses its Z-Power,Moonlightturns intoZ-Moonlightand eliminates any stat drops applied to the user, in addition to its usual effect as above."
Psych Up,Normal,Status,,,10,false,2,"Copies the opponent's stat changes.Z-Move effectsWhen a Pokémon is holdingNormalium Zand uses its Z-Power,Psych Upturns intoZ-Psych Upand fully restores the user's HP, in addition to its usual effect as above.","When a Pokémon is holdingNormalium Zand uses its Z-Power,Psych Upturns intoZ-Psych Upand fully restores the user's HP, in addition to its usual effect as above."
Misty Explosion,Fairy,Special,100,100,5,false,8,The user attacks everything around it and faints upon using this move. This move’s power is increased on Misty Terrain.,
Confuse Ray,Ghost,Status,,100,10,false,1,"Confuse Raycauses the target to become confused. Confused Pokémon have a 33% chance of hurting themselves each turn, for 1-4 attacking turns (50% chance inGenerations 1-6). The damage received is as if the Pokémon attacks itself with a typeless 40 base power Physical attack.","When a Pokémon is holdingGhostium Zand uses its Z-Power,Confuse Rayturns intoZ-Confuse Rayand raises Special Attack one stage, in addition to its usual effect as above."
Rage Powder,Bug,Status,,,20,false,5,Rage Powderredirects all single-target moves used by opponents to itself. It is only useful in double or triple battles.,"When a Pokémon is holdingBuginium Zand uses its Z-Power,Rage Powderturns intoZ-Rage Powderand eliminates any stat drops applied to the user, in addition to its usual effect as above."
Hyper Fang,Normal,Physical,80,90,15,true,1,Hyper Fangdeals damage and has a 10% chance of causing the target to flinch (if the target has not yet moved).,"When a Pokémon is holdingNormalium Zand uses its Z-Power,Hyper Fangturns intoBreakneck Blitzand has base power160."
Counter,Fighting,Physical,,100,20,true,1,"When hit by a Physical Attack, user strikes back with 2x power.Z-Move effectsWhen a Pokémon is holdingFightinium Zand uses its Z-Power,Counterturns intoAll-Out Pummelingand has base power100.","When a Pokémon is holdingFightinium Zand uses its Z-Power,Counterturns intoAll-Out Pummelingand has base power100."
Scratch,Normal,Physical,40,100,35,true,1,Scratchis one of the most common and basic moves a Pokémon learns. It deals damage with no additional effects.,"When a Pokémon is holdingNormalium Zand uses its Z-Power,Scratchturns intoBreakneck Blitzand has base power100."
